brand,brand_source,products_count,unique_names_count,sample_1,sample_2,sample_3
Molino,heuristic,3,3,Galletitas  Molino Natural avena y cacao 240 g,Galletitas Molino Natural avena y granola 236 g,Galletitas Molino Natural avena y pasas 232 g
Muñeca,heuristic,3,3,Set muñeca con accesorios varios modelos,Set muñeca familia,Set muñeca veterinaria
Nadir,heuristic,3,3,Copa Nadir  barone champagne,Copa Nadir champagne windsor,Vaso Nadir  pop.maracatu 280 ml 6 u
Navidad MA,heuristic,3,3,Luces de navidad Ma Light cadena led a pila 50 led,Luces de navidad Ma Light manguera 10mt,Luces navidad MA LIGHT bl.cad.100 led
Nesquick,heuristic,3,3,Cacao Nesquick 180 gr,Cacao Nesquick 360 gr,Cacao Nesquick 800 gr
Pantente,heuristic,3,3,Shampoo Pantente Pro-V detox 200 ml,Shampoo Pantente Pro-V detox 750 ml,Shampoo Pantente Pro-V equilibrio 700 ml
Parrillera,heuristic,3,3,Sal parrillera Dos Anclas bolsa 5 kg,Sal parrillera Dos Anclas estuche 500 gr,Sal parrillera Dos Anclas paquete 1 kg
Partridge,heuristic,3,3,Vino Partridge chardonnay 750 cc,Vino Partridge malbec 750cc,Vino Partridge red blend 750 cc
Paso DE,heuristic,3,3,Gaseosa Paso de los Toros pomelo 1.5 lt,Gaseosa Paso de los Toros pomelo pet 2.25 lt,Gaseosa Paso de los Toros tonica pet 1.5 lt
Patagonia,heuristic,3,3,Cerveza Patagonia 24.7 No Retornable 730 cc,Cerveza Patagonia amber botella No Retornable 730 cc,Cerveza Patagonia vera ipa 730 cc
Plumita,heuristic,3,3,Guantes Plumita afelpados  grande,Guantes Plumita afelpados chico,Guantes Plumita afelpados mediano
Pol. LA,heuristic,3,3,Leche pol. LA SERENISIMA des.vit.400 gr#,Leche pol. LA SERENISIMA desc.vit.200 gr,Leche pol. LA SERENISIMA ent. vit.400 gr
Pomarola,heuristic,3,3,Salsa pomarola Cica 340 gr,Salsa pomarola Knorr 340 gr,Salsa pomarola Noel doypack 340 gr
Quilmes,heuristic,3,3,Cerveza Quilmes 0.0% lata 473 cc,Cerveza Quilmes ipa 473 ml,Cerveza Quilmes lata 473 cc
S,heuristic,3,3,Fideos S & P mostachol 500 g,Fideos S & P spaghetti 500 g,Fideos S & P tirabuzon 500 g
S&p DE,heuristic,3,3,Coctel S&P de 5 frutas 820 gr,Pate S&P de foie 90 gr,Salsa S&P de soja pet 265 cc
Sabanas,heuristic,3,3,Juego de sabanas esencia 2 1/2 plaza 180h,Juego de sabanas esencia king 180h,Juego de sabanas estudio 2 1/2 plaza 144h
Saint,heuristic,3,3,Jabon Saint Tropez brillo/luz 3125g,Jabon Saint Tropez flores 3125 gr,Jabon Saint Tropez hidratacion intensa 3 u 125 grs
Salados,heuristic,3,3,Palitos salados Pehuamar 165 gr,Palitos salados Pehuamar 620 gr,Palitos salados Pehuamar queso 165 gr
Samantha,heuristic,3,3,Escoba Samantha Sophia,Escobillon Samantha Clarisa,Escobillon Samantha Laura
Sens,heuristic,3,3,Desodorante Sens magnolia pera aerosol 123 ml,Perfume Sens grosellas edt con vaporizador 100 ml,Perfume Sens magnolia edt con vaporizador 100 ml
Sexto,heuristic,3,3,Vino Sexto sentido barrica elegida 750 cc,Vino Sexto sentido malbec 750 cc,Vino Sexto sentido malbec reserva 750 cc
Termica,heuristic,3,3,Camiseta termica Cocot T1 T2 T3 T4,Camiseta termica Dufour T2,VASO termica 240ml x25un
Tomate,heuristic,3,3,Pulpa de tomate Salsati tetrabrik 520 gr,Pure tomate Bonmar 520 gr,Pure tomate S&P tetrabrik 260 gr
Tostado,heuristic,3,3,Mani tostado Croppers con sal 105 grs,Mani tostado S&P sin sal 100,Mani tostado S&P sin sal 250
Tranquera,heuristic,3,3,Mate cocido Tranquera suave 50 saquitos,Mate cocido Tranquera tradicional 25 saquitos,Mate cocido Tranquera tradicional 50 saquitos
Triatop,heuristic,3,3,Shampoo Triatop clinical reparacion 400 ml,Shampoo Triatop clinical uso diario 165 ml,Shampoo Triatop clinical uso diario 400 ml
Triturado,heuristic,3,3,Tomate triturado Inca botella 910 gr,Tomate triturado S&P botella 950 gr,Tomate triturado S&P doypack 970 gr
Vainilla,heuristic,3,3,Esencia de vainilla Alicante 100 cc,Esencia de vainilla Dos Anclas 100 cc,Esencia vainilla S&P pet 100 cc
Villamanaos,heuristic,3,3,Agua villamanaos sin gas 600 cc,agua villamanaos bidon x6lt agua villamanaos bidon x6lt agua villamanaos bidon x6lt agua v,agua villamanaos s/g x2lt agua villamanaos s/g x2lt agua villamanaos s/g x2lt agua villama
Bazooka,lookup,3,3,Chicle Bazooka banana 80 4 g,Chicle Bazooka menta 80 un 4 g,Chicle Bazooka tutti frutti 80 4 g
Beldent,lookup,3,3,Chicles Beldent frutilla 10 g,Chicles Beldent menta fuerte 10 g,Chicles Beldent mentol 10 g
Blue Patna,lookup,3,3,Fideos Blue Patna fetuccini sin tacc 500 gr,Fideos Blue Patna mostacholes sin tacc 500 gr,Fideos Blue Patna spaghetti sin tacc 500 gr
Brighton,lookup,3,3,Gin Brighton 700 ml,Gin Brighton pink 700 ml,Gin Brighton tangerine 700 ml
Bubbaloo,lookup,3,3,Chicle Bubbaloo frutilla 60 u,Chicle Bubbaloo tutti frutti 60 u,Chicle Bubbaloo uva 60 u
Cabrales,lookup,3,3,Cafe Cabrales en saquitos 18 u 5 g,Capsulas Cabrales cafe nespresso colombia 10 u,Capsulas Cabrales latte dg 10 u
Chango,lookup,3,3,Azucar CHANGO bajas calorias x500g,Azucar CHANGO fantasia x250g,Azucar CHANGO organica S/TACC x1kg
Clear,lookup,3,3,Shampoo Clear 2en1 dual effect 200 ml,Shampoo Clear 2en1 dual effect 400 ml,Shampoo Clear caida control 400 ml
Cofler Block,lookup,3,3,Alfajor Cofler Block simple 6 u,Alfajor Cofler block 60 gr,Galletitas Cofler Block 120/124 gr
Don Vicente,lookup,3,3,Fideos DON VICENTE tallar.a/huevo x500gr,Fideos Don vicente caserito al huevo 500 gr,Fideos Don vicente fettu al huevo 500 gr
Dura,lookup,3,3,Durazno S&P en trozos 3 kg,Durazno S&P en trozos 820 gr,Durazno S&P mitad 3 kg
Elemento,lookup,3,3,Vino Elementos cabernet 750 cc,Vino Elementos malbec 750 cc,Vino Elementos torrontes 750 cc
Estancia,lookup,3,3,Vino Estancia Mendoza cabernet 750 cc,Vino Estancia Mendoza malbec 750 cc,Vino Estancia Mendoza malbec cabernet 750 cc
Fastix,lookup,3,2,Pegamento Fastix interior blanco 25 gr,Pegamento Fastix interior transparente 25 gr,
Ferrero Rocher,lookup,3,3,Bombones Ferrero Rocher 12 u,Bombones Ferrero Rocher 24 u,Bombones Ferrero Rocher 8 u
Flow,lookup,3,3,Colonia FLOWER ROSE edc x250ml,Desodorante Flower Rose aerosol 123 cc,Perfume Flower Rose eau de toilette con vaporizador 40 ml
Fond de Cave,lookup,3,3,Vino Fond de Cave cabernet 750 cc,Vino Fond de Cave malbec 750 cc,Vino Fond de Cave reserva malbec 750 cc
Formis,lookup,3,3,Cereales Formis frutal 145 gr,Galletitas Formis chocolate rellenas vainillas 102 gr,Galletitas Formis vainilla / chocolate 72 gr
Genser,lookup,3,3,Semillas Genser mi desayuno doypack 150 gr,Semillas Genser mi ensalada / sopas doypack 150 gr,Semillas Genser sesamo doypack 120 gr
Gentleman,lookup,3,3,Anana Gentleman rodajas lata 567 g,Anana Gentleman rodajas lata 820 g,Coctel Gentleman 5 frutas 820 g
Georgalos,lookup,3,3,Chocolate Georgalos blanco 8 gr,Chocolate Georgalos ne gro 8 gr,Huevo de pascua Georgalos con bombones 75 gr
Krachitos,lookup,3,3,Palito Krachitos salados 500 gr,Papas fritas Krachitos corte americano 420 gr,Papas fritas Krachitos corte tradicional 420 gr
La Cumbrecita,lookup,3,3,Yerba La Cumbrecita 1 kg,Yerba La Cumbrecita 500 gr,Yerba La Cumbrecita burrito 500 g
Las 3 Niñas,lookup,3,3,Leche las 3 niñas descremada 1% tetrabrik 1 lt,Leche las 3 niñas deslactosada tetrabrik 1 lt,Leche las 3 niñas entera 3% tetrabrik 1 lt
Lincoln,lookup,3,3,Galletitas Lincoln 153 gr,Galletitas Lincoln 219 gr,Galletitas Lincoln chocolate 153 gr
Lola,lookup,3,3,Vino Lola Montes cabernet sauvignon 750 cc,Vino Lola Montes rose 750 cc,Vino Lola montes malbec 750 cc
Lumilagro,lookup,3,3,Termo Lumilagro luminox azul 1 lt,Termo Lumilagro luminox blanco 1 lt,Termo Lumilagro luminox negro 750 ml
Mantecol,lookup,3,3,Oblea Mantecol rellena 27 g,Postre Mantecol 110 gr,Relleno Mantecol untable pote 278 g
Mr Pops,lookup,3,3,Chupetin Mr Pop´s evolution blueberry 24 u,Chupetin Mr Pop´s frutal 50 u,Chupetin Mr Pop´s trompito twister 50 u
Navarro Correas,lookup,3,3,Vino Navarro Correas Cole ccion Privada cabernet 750 cc,Vino Navarro Correas Colección Privada malbec 750 cc,Vino Navarro Correas reserva cabernet 750 cc
Nosotras,lookup,3,3,Tampones Nosotras mini 8 u,Tampones Nosotras regular 8 u,Tampones Nosotras super 8 u
Novecento,lookup,3,3,Vino Novecento Raices cabernet 750 cc,Vino Novecento cabernet 750 cc,Vino Novecento malbec 750 cc
Opera,lookup,3,3,Obleas Opera 4 u 55 gr,Obleas Opera 55 gr,Obleas Opera 92 gr
Palitos de la Selva,lookup,3,3,Caramelos PALITOS DE LA SELVA 660 gr,Caramelos palitos de la selva 150 gr,Chupetin Palitos De La Selva frutilla y vainilla 432 grs
Patito,lookup,3,3,Guantes Patito clasicos mu ltiuso CH,Guantes Patito clasicos mu ltiuso G,Guantes Patito clasicos mu ltiuso L
Pepitos,lookup,3,3,Galletitas Pepitos 119 gr,Galletitas Pepitos 3 u 119 gr,Galletitas Pepitos mini 50 g
Pico,lookup,3,3,Caramelos Pico Dulce 450 gr,Chupetin Pico Dulce display 24 u,Chupetin Pico Dulce pote 48 u
Pond's,lookup,3,3,Crema Pond's pepino 100 ml,Crema Pond's rejuveness dia 100 ml,Crema Pond's rejuveness noche 100 ml
Roby,lookup,3,3,Gel Roby humedo con aloe 150 g,Gel Roby normal con aloe 150 g,Protector Roby termico 190 ml
Savora,lookup,3,3,Mostaza Savora original doy pack 250 gr,Mostaza Savora original doy pack 500 gr,Mostaza Savora original sachet 60 gr
Shooter,lookup,3,3,Aperitivo Shooter gin & tonic lata x355c,Aperitivo Shooter vodka lima lata 355 cc,Aperitivo Shooter vodka pomelo lata 355 cc
Snuks,lookup,3,3,Almohadita Snuks relleno chocolate 200/240 gr,Almohadita Snuks relleno de avellana 200/240 gr,Almohadita Snuks relleno frutilla 200/240 gr
Sun,lookup,3,3,Lavavajilla Sun sal regeneradora 1 kg,Lavavajillas Sun Pro gress sal abrillantador 500 cc,Lavavajillas Sun tabletas 20 u
Topline,lookup,3,3,Chicle Topline 7 menta 16 u,Chicle Topline fruta 20 u,Chicle Topline turbo mint 12 u 125 gr
Tostitos,lookup,3,3,Nacho Tostitos 160 g,Nacho Tostitos 260 g,Nachos Tostitos 100 g
Traviata,lookup,3,3,Galletitas Traviata 108 gr,Galletitas Traviata 3 u 108 gr,Galletitas Traviata 5 u 108 gr
Trenet,lookup,3,3,Quitamachas Trenet Oxi prelavado espuma recarga economica doy pack 400 cc,Quitamancha Trenet prelavado bolilla 120 cc,Quitamanchas Trenet Oxi  prelavado espuma gatillo 500
Trumpeter,lookup,3,3,Vino Trumpeter chardonnay 750 cc,Vino Trumpeter malbec 750 cc,Vino Trumpeter malbec estuche 2 u 750 cc
Valente,lookup,3,3,Madalena Valente rellena dulce de leche 200 gr,Vainilla VALENTE x148gr,Vainilla VALENTE x444gr
Viñas de Alvear,lookup,3,3,Vino Viñas de Alvear blanco 1.125 lt,Vino Viñas de Alvear red blend 1.125 lt,Vino Viñas de Alvear tinto 1.125 lt
Wamis,lookup,3,3,Chupetin Wamis dulce de leche 50 u,Chupetin Wamis frutal 50 u,Chupetin Wamis magico 50 u
Generico,generico,2,2,ESPUMADERA,PISAPAPA,
Aguijon DE,heuristic,2,2,Vino Aguijon de abeja obrera cabernet franc 750 cc,Vino Aguijon de abeja obrera malbec 750 cc,
Alcohol,heuristic,2,2,Vinagre de alcohol S&P 1 lt,Vinagre de alcohol S&P 500 cc,
Algodon,heuristic,2,2,Mopa algodon Task repuesto,Paño algodon Estrella 40 u,
Amargo,heuristic,2,2,Aperitivo Amargo Obrero 950 cc,Cacao amargo Dicomere sin tacc 200 g,
Ana,heuristic,2,2,Perfume Ana Glam edp con vap 75 ml,Perfume Ana pink eau de parfum 75 ml,
Autoadherente,heuristic,2,2,Film pvc autoadherente Bonu 28 cm 15mt,Film pvc autoadherente Bonu 28 cm 30mt,
Avon,heuristic,2,2,Cuaderno Avon espiral tapa blanda cuadriculado 84 hojas,Cuaderno avon espiral tapa blanda rayado 84 hojas,
Bar,heuristic,2,2,Piña colada Bar & Pubs 1 lt,granadina Bar & Pubs 1 lt,
Barritas,heuristic,2,2,Galletitas Barritas frutos del bosque 160 g,Galletitas Barritas membrillo 160 g,
Bay,heuristic,2,2,Galletita Bay Biscuit 142 gr,Galletita Bay Biscuit mini 140 gr,
Bañada,heuristic,2,2,Galletita bañada Tita clasica nuevo 36 u 19 gr,Galletita bañada Tita clasica nuevo 519 gr,
Beepure,heuristic,2,2,Miel Beepure clasica frasco 500 gr,Miel Beepure cremosa frasco 500 gr,
Blanco,heuristic,2,2,Choclo blanco Inca cremoso 350 gr,Choclo blanco S&P cremoso 300/350 gr,
Bonmar,heuristic,2,2,Atun Bonmar desmenuzado al natural170 gr,Atun Bonmar desmenuzado en aceite 170 gr,
Bonu MA,heuristic,2,2,Papel higienico Bonu ma hoja simple 4 u 80mt,Papel higienico Bonu ma hoja simple 6 u 80mt,
Borrar,heuristic,2,2,Goma de borrar Faber Castell lapiz 2 u,Goma de borrar Faber Castell lapiz y tinta 2 u,
Brahma,heuristic,2,2,Cerveza Brahma chopp lata 355 ml,Cerveza Brahma lata 473 cc,
Budin,heuristic,2,2,Premezcla budin Exquisita chocolate 300 gr,Premezcla budin Exquisita vainilla 300 gr,
Budweiser,heuristic,2,2,Cerveza Budweiser lata 473 cc,Cerveza Budweiser lata 710 cc,
Casera,heuristic,2,2,Mayonesa casera hellmanns doy pack 232 gr,Sopa casera KNORR c/pasta trico.107.5 gr,
Caserita,heuristic,2,2,Harina Caserita 000 5 kg,Harina Caserita 0000 5 kg,
Casona,heuristic,2,2,Vino Casona Lopez cabernet 750 cc,Vino Casona Lopez malbec 750 cc,
Chocolino,heuristic,2,2,Cacao Chocolino fortificado 180 gr,Cacao Chocolino fortificado 800 gr,
Closeup,heuristic,2,2,Cepillo dental Closeup deep action mediano,Cepillo dental Closeup deep clean mediano 21,
Cocoliche,heuristic,2,2,Vino Cocoliche malbec 750 cc,Vino Cocoliche reserva malbec 750 cc,
Colacchio,heuristic,2,2,Fideos Colacchio penne birigate 500 g,Fideos Colacchio spaghetti 500 g,
Conc,heuristic,2,2,Suav conc COMFORT expl lavand d/p x450ml,Suav conc COMFORT frescor inten bot x1lt,
Coqueterias,heuristic,2,2,Perfume Coqueterias Flowers eu de toillette 40 ml,Perfume Coqueterias eau de toilette 90 ml,
Cordero,heuristic,2,2,Vino Cordero con piel de lobo cabernet 750 cc,Vino Cordero con piel de lobo malbec 750 cc,
Corona,heuristic,2,2,Cerveza Corona cero porron No Retornable 330 cc,Cerveza Corona porron No Retornable 330/355 cc,
Crackers,heuristic,2,2,Galletitas crackers S&P 300 gr,Galletitas crackers S&P salvado300 gr,
Crema,heuristic,2,2,Sopa crema KNORR verduras nueva 60 gr,Sopa crema KNORR zapallo c/nuez m. 70 gr,
Cuadros,heuristic,2,2,Mantel cuadros azul 1.60 x 2 m,Mantel cuadros bordado 160 x 200 cm,
Cubiertos,heuristic,2,2,Set Cubiertos + organizador para cubiertos azul 26 piezas,Set Cubiertos + organizador para cubiertos tiffany 26piezas,
Depimiel,heuristic,2,2,Crema depilatoria Depimiel para cuerpo 120 gr,Crema depilatoria Depimiel para rostro A+B 45 gr,
Desinfectantes,heuristic,2,2,Toallitas desinfectantes Ayudin fresco 65 u,Toallitas desinfectantes Ayudin fresco doy pack 35 u,
Desodorante,heuristic,2,2,Talco desodorante Algabo perfume floral 200 gr,Talco desodorante Algabo perfume floral 250 gr,
Digital,heuristic,2,2,BALANZA digital,Freidora digital Bonux / Vtl 4.5 lt,
Duffy,heuristic,2,2,Pañal Duffy cotton hiper G 32 u,Pañal Duffy premium cotton M 40 u,
Dulce,heuristic,2,2,Madalena  Dulce Mama vainilla 200 gr,Madalena  Dulce Mama vainilla rellena de dulce de leche 200 gr,
Durigutti,heuristic,2,2,Vino Durigutti cabernet 750 cc,Vino Durigutti malbec 750 cc,
El Bautismo,heuristic,2,2,Vino El Bautismo blend de tintas 750 cc,Vino El Bautismo malbec 750 cc,
Ensaladera,heuristic,2,2,Set ensaladera Bonu Hogar bicolor 7 pzas,Set ensaladera Bonu Hogar cuadrada 3 pzas,
Etilico BI,heuristic,2,2,Alcohol etilico BI ALCOHOL 70% x1lt,Alcohol etilico Bi Alcohol 70% 500 cc,
Etílico,heuristic,2,2,Alcohol etílico Alco Protect 1 lt,Alcohol etílico Alco Protect 500 ml,
Executive,heuristic,2,2,Cuaderno Executive espiral negro cuadriculado 84 hojas,Cuaderno Executive espiral negro rayado 84 hojas,
Filetto,heuristic,2,2,Salsa filetto Cica 340 gr,Salsa filetto Knorr 340 gr,
Film,heuristic,2,2,Papel film Glow 1 u x 15 mts,Papel film Glow 1 u x 30 mts,
Fino,heuristic,2,2,Alcohol fino Carmel 1 lt,Alcohol fino Carmel 500 cc,
Fran,heuristic,2,2,Vino Fran cabernet sauvignon 750 cc,Vino Fran chardonnay 750 ml,
Frita,heuristic,2,2,Papa frita Krachitos cheddar 330 / 350 gr,Papa frita Krachitos sabor jamon 300 / 330 gr,
Furbol,heuristic,2,2,Pelota furbol Goldsoni n5 amarilla,Pelota furbol Goldsoni n5 verde,
Guardia,heuristic,2,2,Arvejas GUARDIA VIEJA part. bolsa 400 gr,Garbanzos GUARDIA VIEJA bolsa 400 gr,
Hermetico,heuristic,2,2,FRASCO HERMETICO vidrio 1 lt,Set Hermetico Crom bari chato 2 un,
Imperial,heuristic,2,2,Cerveza IMPERIAL extra lager lata x473cc,Cerveza Imperial golden lata 473 cc,
Inodoro,heuristic,2,2,Canasta inodoro Ayudin 16 gr,Limpiador inodoro Harpic en gel removedor de sarro 500 cc,
Kamado,heuristic,2,2,Parrilla Kamado Stone 16 pulgadas,Parrilla Kamado Stone 21 pulgadas,
Kellog S,heuristic,2,2,Cereal Kellog s choco krispis 185 gr,Cereal Kellog s froot loops 330 gr,
King,heuristic,2,2,ACOLCHADO king beige 229259 cm,CUBRECAMA king  gris 229259 cm,
La Huerta,heuristic,2,2,Pure de tomate De La Huerta 1030 gr,Pure de tomate De La Huerta 530 gr,
La Linda,heuristic,2,2,Vino La Linda malbec 750 cc,Vino La Linda sweet viognier  750 cc,
Leche LA,heuristic,2,2,Dce. leche LA SERENISIMA colo.calc250 gr,Dce. leche LA SERENISIMA colo.calcio1 kg,
Linea,heuristic,2,2,CUCHILLO Linea Leve Blanco 50un,TENEDOR Linea Leve Blanco 50un,
Liso,heuristic,2,2,Individual liso azul 6 u,Individual liso beige 6 u,
Listo,heuristic,2,2,Mate listo Taragui,Mate listo Taragui botella termica,
Luchettinis DE,heuristic,2,2,Capelettini Luchettinis de espinaca y queso 500 gr,Capelettini Luchettinis de jamon y queso 500 gr,
Madera,heuristic,2,2,Broches de madera Bonux 12 u,Broches de madera Task 12 u,
Mano,heuristic,2,2,Cepillo de mano Samantha many,Pala de mano Glow libra,
Maximo,heuristic,2,2,Arroz Maximo largo fino 1 kg,Arroz Maximo largo fino 500 kg,
Molido,heuristic,2,2,Cafe molido Super Cabrales 265 gr,Cafe molido Super Cabrales 500 gr,
Morie,heuristic,2,2,Pan rallado Morie 1 kg,Pan rallado Morie 500 gr,
Moutier,heuristic,2,2,Espumante Moutier extra brut 750 cc,Espumante Moutier extra dulce 750 cc,
Mu,heuristic,2,2,Cesto mu ltienvase vaiven popart decorado 3 lt,Tabla mu ltienvase para picar,
Nampe,heuristic,2,2,Vino Nampe cabernet 750 cc,Vino Nampe malbec 750 cc,
Ne,heuristic,2,2,Pimienta ne gra Alicante molida 25 gr,Pimienta ne gra Dos Anclas en  grano 50 gr,
Nidina,heuristic,2,2,Leche en polvo Nidina Bebe 1 800 gr,Leche en polvo Nidina Bebe 2 800 gr,
Noble,heuristic,2,2,Papel higienico Noble doble hoja 4 u 30 mt,Rollo de cocina Noble 3 x 40 paños,
Nonisec,heuristic,2,2,Paï¿½al Nonisec adulto XXG 10 u,Pañal Nonisec adulto con gel XG 10 u,
Nylon,heuristic,2,2,Espatula de nylon,PINZA nylon para comida,
Origen,heuristic,2,2,Vino Origen cabernet sauvignon 750 cc,Vino Origen malbec 750 cc,
Parboil,heuristic,2,2,Arroz parboil MOLINOS ALA g.sel. x500gr,Arroz parboil MOLINOS ALA g.selecto x1kg,
Pascuas,heuristic,2,2,Huevo pascuas Mantecol semiamargo con bocadito 200 g,Huevo pascuas Tokke bombon con dulce de leche 152gr,
Pino,heuristic,2,2,Desodorante Pino Colbert aerosol 250 cc,Perfume Pino Colbert eau de toilette 60 ml,
Pinoluz,heuristic,2,2,Limpiador Pinoluz fragancia verde pino 4 lt,Limpiador Pinoluz fragancia verde pino 900 cc,
Plastico,heuristic,2,2,Broches de plastico Bonux 12 u,Jarra de plastico 1.2 lt + 4 vasos,
Plegable,heuristic,2,2,Gazebo plegable 33mt,Monopatin plegable con luces bonux hogar,
Polvo LA,heuristic,2,2,Leche polvo La Lechera nutrifuerza con hierro 800 gr,Leche polvo La Paulina entera 800 gr,
Preparado,heuristic,2,2,Arroz preparado Gallo queso seleccion 240 gr,Arroz preparado Gallo vegetales seleccion 240 gr,
Purisima,heuristic,2,2,Leche en polvo Purisima descremada 30 u 5 gr,Leche en polvo Purisima entera 400 gr,
Quick,heuristic,2,2,Sopa Quick vegetales 46.5 gr,Sopa Quick vegetales balance 46.5 gr,
Rayado,heuristic,2,2,Mantel rayado blanco/beige 200 x 300 cm,Repasador rayado azul/blanco 2 u,
Re,heuristic,2,2,Galletitas Re estuche 125 gr,Limpiador Re acero inoxidable gatillo 500 cc,
Reap,heuristic,2,2,Hidrolavadora REAP 1400wats,Hidrolavadora reap 1600wats,
Reclinable,heuristic,2,2,Reposera reclinable 4 posiciones acero,Reposera reclinable 8 posiciones acero,
Royacamp,heuristic,2,2,Carpa Royacamp para 2 personas 20012095 cm,Carpa Royacamp para 4 personas 210210130 cm,
S&p AL,heuristic,2,2,Caballa S&P al natural 380/425 gr,Jurel S&P al natural 425 gr,
Sanitarias,heuristic,2,2,Piedras sanitarias TIDY CATS 1.8 kg,Piedras sanitarias TIDY CATS 3.6 kg,
Saquitos LA,heuristic,2,2,Cafe en saquitos La Morenita torrado clasicos 20 u,Cafe en saquitos La Virginia Mi Cafe  20 u,
Schneider,heuristic,2,2,Cerveza Schneider lata 473 cc,Cerveza Schneider lata 710 cc,
Sense,heuristic,2,2,Body sense Prestobarba 3  4 u,Body sense Prestobarba 3 2 u,
Sm,heuristic,2,2,PLATOS sm cocina practica 15cm 10un,PLATOS sm cocina practica 23cm 10un,
Soft,heuristic,2,2,Tintura Soft color kit 73 rubio avellana,Tintura Soft color kit 7745 granada intense,
Sri,heuristic,2,2,Cepillo dental Sri Sri medio para adultos,Cepillo dental Sri Sri suave para adultos,
St,heuristic,2,2,Crema corporal St Ives humectacion diaria 350 ml,Crema corporal St Ives humectacion profunda 532 ml,
Stella,heuristic,2,2,Cerveza Stella Artois lager lata 710 cc,Cerveza Stella Artois lata 473 cc,
Strega,heuristic,2,2,Licor Strega 700 cc,Licor Strega limoncello 700 cc,
Sturla,heuristic,2,2,Granola Sturla manzana 200 g,Semillas Sturla girasol doypack 250 gr,
Surtido,heuristic,2,2,Galletitas Surtido Bagley 398 gr,Galletitas surtido Diversion 400 g,
Tazas,heuristic,2,2,Set de tazas Durax cafe con plato 8 piezas,Set tazas Carol vidrio doble 350 ml 2 u,
Termico,heuristic,2,2,Jarro termico Contigo huron rosé 473 ml,VASO termico 180ml x25un,
Texto,heuristic,2,2,Vino Texto Subito blend cabernet sauvignon petit verdot 750 cc,Vino Texto Subito blend malbec cabernet sauvignon 750 cc,
Vinagre,heuristic,2,2,Ajies en vinagre Yovinessa x 330 gr,Ajies en vinagre Yovinessa x 800 gr,
Vtl/bonux,heuristic,2,2,ANAFE VTL/Bonux electrico doble,ANAFE VTL/Bonux electrico simple,
Yuca,heuristic,2,2,Galletitas Yuca miel 150 gr,Galletitas Yuca pepitas 150 gr,
Zambia,heuristic,2,2,Taza zambia amarilla 320 cc,Taza zambia verde 320 cc,
Zucaritas,heuristic,2,2,Cereal Zucaritas 510 gr,Cereal Zucaritas chocolate 240 gr,
Zumuva,heuristic,2,2,Vino Zumuva tinto dulce tetrabrik 1 lt,Vino Zumuva tinto tetrabrik 1 lt,
1882,lookup,2,2,Fernet 1882 1 lt,Fernet 1882 450 cc,
1930,lookup,2,2,Sidra 1930 demi sec 750 cc,Sidra 1930 dolce lata 355 cc,
Absolut,lookup,2,2,Vodka Absolut 700/750 cc,Vodka Absolut Raspberri 750 cc,
Acapulco,lookup,2,2,Palmitos ACAPULCO trozos 400 gr,Palmitos Acapulco trozos 810 gr,
Aime,lookup,2,2,Vino Aime cabernet 750 cc,Vino Aime red blend 750 cc,
Amor,lookup,2,2,Galletitas Amor 3 u 112/108 gr,Galletitas Amor cupido 112 gr,
Bacardi,lookup,2,2,Ron Bacardi blanco 700 cc,Ron Bacardi oro 700 cc,
Bauducco,lookup,2,2,Tostada Bauducco clasica 142 gr,Tostada Bauducco multigrano 142 gr,
Baygon,lookup,2,2,Insecticida Baygon mata moscas y mosquitos 300 cc,Matacucarachas Baygon 300 cc,
Beefeater,lookup,2,2,Gin Beefeater London dry 1 lt,Gin Beefeater London dry 700/750 cc,
Blancaflor,lookup,2,2,Harina Blancaflor leudante fort. 1 kg,Premezcla Blancaflor pizza 400 grs,
Blancanuez,lookup,2,2,Nuez Blancanuez con cascara 250 gr,Nuez Blancanuez pelada 100 gr,
Bombay,lookup,2,2,Gin Bombay Bramble 700 cc,Gin Bombay Sapphire 750 cc,
Branca,lookup,2,2,Fernet Branca menta 450 cc,Fernet Branca menta 750 cc,
Bull Dog,lookup,2,2,Pastillas Bull Dog mi mandarina/uva 30 gr,Pastillas Bull Dog mi sandia/manzana30 gr,
Canarias,lookup,2,2,Yerba Canarias tradicional 1 kg,Yerba Canarias tradicional 500 g,
Canciller,lookup,2,2,Vino CANCILLER cabernet 750 ml,Vino Canciller malbec 750 ml,
Cantus,lookup,2,2,Vino Cantus chenin dulce 750 cc,Vino Cantus malbec 750 cc,
Caracas,lookup,2,2,Champignon Caracas trozos lata 400 g,Morron Caracas entero 185/220 gr,
Carpano,lookup,2,2,Vermouth CARPANO bianco 950 cc,Vermouth Carpano rosso 950 cc,
Cerealita,lookup,2,2,Galletitas Cerealitas 3 u 207 / 212 gr,Galletitas Cerealitas salvado 208 gr,
Chamigo,lookup,2,2,Yerba Chamigo 500  gr,Yerba Chamigo sin tacc 1 kg,
Clight,lookup,2,2,Caramelos CLIGHT frambuesa 12 u 20 gr,Caramelos CLIGHT naranja dulce 20 gr,
Cobra,lookup,2,2,Autobrillo Cobra ne gro 60 cc,Pomada Cobra 4 en 1 ne gro 30 gr,
Colombraro,lookup,2,2,Escurridor Colombraro serra con bandeja,Vertedor Colombraro transparente  grande,
Doble V,lookup,2,2,Whisky Doble V etiqueta negra 200 cc,Whisky Doble V etiqueta negra x1lt,
Don David,lookup,2,2,Vino Don David cabernet 750 cc,Vino Don David malbec 750 cc,
Don Valentin,lookup,2,2,Vino Don Valentin lacrado tinto 750 cc,Vino Don Valentin malbec 750 cc,
Echo,lookup,2,2,Cera Echo acondiciona clasico doy pack 450 ml,Cera Echo clasica botella 900 cc,
Esani,lookup,2,2,Grasa Esani cerdo x500gr,Grasa Esani vacuna x500gr,
Escorihuela Gascon,lookup,2,2,Vino Escorihuela Gascon Gran reserva malbec x750cc,Vino Escorihuela Gascon malbec 750 cc,
Finish,lookup,2,2,Lavavajillas Finish abrillantador 400 cc,Lavavajillas Finish en polvo para maquinas doy pack 1 kg,
Fresita,lookup,2,2,Espumante Fresita 750 cc,Espumante Fresita orange sunset 750 cc,
Gambei,lookup,2,2,Espumante Gambei brut rose 750 cc,Espumante Gambei dulce 750 cc,
Gancia,lookup,2,2,Aperitivo Gancia 0.0 sin alcohol 473 ml,Aperitivo Gancia hibiscus vodka 473 ml,
Gongys,lookup,2,2,Malvavisco Gongys vainilla trenza 200g,Malvavisco Gongys vainilla trenza 28 gr,
Hellmans,lookup,2,2,Mayonesa Hellmans aceite 100% girasol doy pack 237 gr,Mayonesa Hellmans ajo doy pack 250 gr,
Issue,lookup,2,2,Tintura Issue keratin kit 1 negro,Tintura Issue protección keratina kit 1 negro,
Jardin,lookup,2,2,Jardinera S&P lata 300/350 gr,MACETA JARDIN mediana varios modelos,
Kesitas,lookup,2,2,Galletitas Kesitas 75 gr,Galletitas Kesitas estuche 125 gr,
Koleston,lookup,2,2,Tintura Koleston kit 28 negro azulado,Tintura Koleston kit 70 rubio mediano,
La Gotita,lookup,2,2,Pegamento La Gotita instantaneo 2 ml,Pegamento La gotita gel adhesivo 3 gr,
Lario,lookup,2,2,Gin Larios dry 700 cc,Gin Larios rose 700 cc,
Lord,lookup,2,2,Gel Lord Cheseline en pomo 150 gr,Gel Lord Cheseline en pote 280 gr,
Marlo,lookup,2,2,Bizcochuelo Marloms taza vainilla 70 gr,Popcorn Marloms dulce 87 gr,
Marques del Sur,lookup,2,2,Vino MARQUES DEL SUR malbec 750 cc,Vino Marques del sur cabernet 750 cc,
Martini,lookup,2,2,Vermouth Martini blanco 1 lt,Vermouth Martini rosso 1 lt,
Mayoliva,lookup,2,2,Mayonesa Mayoliva doy pack 250 cc,Mayonesa Mayoliva sachet 125 gr,
