brand,brand_source,products_count,unique_names_count,sample_1,sample_2,sample_3
Media Tarde,lookup,2,2,Galletitas Media Tarde 3 u 105 gr,Galletitas Media Tarde sandwich 5107 gr,
Melba,lookup,2,2,Galletitas Melba 120 gr,Galletitas Melba 360 gr,
Mellizas,lookup,2,2,Galletitas Mellizas 112/108 gr,Galletitas Mellizas 3 u 112/108 gr,
Milkaut,lookup,2,2,Dulce de leche Milkaut pote 1 kg,Dulce de leche Milkaut repostero 1 kg,
Mr Musculo,lookup,2,2,Limpiador Mr musculo antigrasa dp 450 ml,Limpiador Mr musculo vi/multiuso dp 450 ml,
Muñeco Rebelde,lookup,2,2,Vino Muñeco rebelde blanco dulce 750 cc,Vino Muñeco rebelde malbec 750 cc,
Nutrifoods,lookup,2,2,Copos Nutrifoods zucar flakes 200 gr,Granola Nutrifoods con pasas balance 320 grs,
Pipore,lookup,2,2,Yerba Pipore suave clasica 1  kg,Yerba Pipore suave clasica 500  gr,
Poxipol,lookup,2,2,Pegamento Poxipol  gris 14 ml,Pegamento Poxipol transparente 14 ml,
Protex,lookup,2,2,Jabon Protex carbon detox 125 gr,Jabon liquido PROTEX balance d/p 200 ml,
Rhodesia,lookup,2,2,Oblea Rhodesia clasica 36 u 22 gr,Oblea Rhodesia clasica 4 u 22 gr,
Rocklets,lookup,2,2,Chocolate Rocklets confitado 20 gr,Chocolate Rocklets confitado 40 gr,
Rumba,lookup,2,2,Galletitas Rumba 110/108 gr,Galletitas Rumba 3 u 110/108 gr,
Rutini,lookup,2,2,Vino Rutini cabernet/malbec 750 cc,Vino Rutini cabernet/malbec estuche 750 cc,
San Felipe,lookup,2,2,Vino San Felipe cabernet 750 cc,Vino San Felipe malbec 750 cc,
San Telmo,lookup,2,2,Vino San Telmo cabernet 750 cc,Vino San Telmo malbec 750 cc,
Sapito,lookup,2,2,Chocolate Sapito relleno dulce de leche 10 gr,Chocolate Sapito relleno mani 10 gr,
Selton,lookup,2,2,Repelente Selton aerosol 165 ml,Repelente Selton extra duracion aerosol 165 ml,
Sexy Fish,lookup,2,2,Vino Sexy fish cabernet franc 750 cc,Vino Sexy fish malbec 750 cc,
Shot,lookup,2,2,Alfajor Shot mini 6 u,Chocolate Shot 35 gr,
Sonrisas,lookup,2,2,Galletitas Sonrisas frambuesa 118 gr,Galletitas Sonrisas frambuesa 3 u 118 gr,
Starbucks,lookup,2,2,Capsulas Starbucks blonde expresso roast 10 u,Capsulas Starbucks colombia 10 u,
Sugus,lookup,2,2,Caramelos Sugus confitado estuche 50 gr,Chupetines Sugus rellenos halloween 384 g,
Takis,lookup,2,2,Nacho Takis Intense Flow bar x140g,Nacho Takis Intense Flow bar x85g,
Termidor,lookup,2,2,Vino Termidor blanco tetrabrik 1 lt,Vino Termidor tinto tetrabrik 1 lt,
Tia Maria,lookup,2,2,Licor Tia Maria cream liqueur 690 cc,Licor Tia Maria liqueur 690 cc,
Trapiche,lookup,2,2,Vino Trapiche impuro malbec 750 cc,Vino Trapiche reserva malbec 750 cc,
Trix,lookup,2,2,Cereal Trix 230 gr,Cereal Trix 330 gr,
Variedad,lookup,2,2,Galletitas VARIEDAD dorada 300 / 310 gr,Galletitas Variedad ahora mas  590/610 gr,
Vin Up,lookup,2,2,Vino Vin up blanco tetrabrik 1 lt,Vino Vin up tinto tetrabrik 1 lt,
Vita,lookup,2,2,Leche Vital Infantil 2 tetrabrik x200cc,Leche Vital Infantil 3 tetrabrik x200cc,
Vocacion,lookup,2,2,Galletitas Vocacion clasicas 141 gr,Galletitas Vocacion clasicas 3 u 128 g,
Wd-40,lookup,2,2,Lubricante WD-40 aerosol 155 gr,Wd-40 220 gr,
Ziploc,lookup,2,2,Bolsa Ziploc multipack 9 u,Bolsa Ziploc para conservar grande 10 u,
00000,heuristic,1,1,Arroz 00000 largo fino Dos hermanos 5 kg,,
11,heuristic,1,1,TENDER 11 varillas,,
4,heuristic,1,1,Salsa 4 quesos Alicante 37 gr,,
5,heuristic,1,1,Granola 5 semillas 1 kg,,
9,heuristic,1,1,TENDER 9 varillas con alas,,
9de,heuristic,1,1,Crujitas 9de oro cebolla y crema 120 g,,
Aa,heuristic,1,1,Desodorante Aa Glam aerosol 123 ml,,
Aire,heuristic,1,1,COMPRESOR de aire 12v,,
Ajo,heuristic,1,1,Sal con ajo Dos Anclas salero 200 gr,,
Ají,heuristic,1,1,Salsa ají S&P picante 285 gr,,
Alas,heuristic,1,1,Tender con alas capello,,
Alioli,heuristic,1,1,Salsa alioli Dos Anclas 360 gr,,
Almendras,heuristic,1,1,Harina de almendras Dicomere sin tacc 200 gr,,
Amstel,heuristic,1,1,Cerveza Amstel lata 473 cc,,
Andador,heuristic,1,1,Bebote andador unicornio con sonido 38 cm,,
Animales,heuristic,1,1,PELUCHE animales 1m,,
Antibacteriales,heuristic,1,1,Toallitas antibacteriales Espadol 10 u,,
Arvejas Y,heuristic,1,1,Mix arvejas y choclo S & P lata 300 g,,
Asador,heuristic,1,1,Set Asador cuchillas 2 piezas,,
Autoarmable,heuristic,1,1,Carpa autoarmable para 4 personas 210240130 cm,,
Automatico,heuristic,1,1,Cesto automatico,,
Autor,heuristic,1,1,Resma Autor A4 75 gr  500 hojas,,
Autos,heuristic,1,1,PISTA DE AUTOS maico loop con autito,,
Avellana/cacao,heuristic,1,1,Pasta avellana/cacao Nutella 140 gr,,
Avellanas,heuristic,1,1,Pasta de avellanas S&P 350 g,,
Azucarados,heuristic,1,1,Copos azucarados Nutrifoods 1 kg,,
Azucel,heuristic,1,1,Azucar AZUCEL comun x1kg,,
Ballantines,heuristic,1,1,Whisky Ballantines 750 cc,,
Basico PP,heuristic,1,1,VASO Basico PP 300ml 100un,,
Basico PS,heuristic,1,1,VASO Basico PS 180ml 100un,,
Bateria,heuristic,1,1,Cuatriciclo a bateria 6V,,
Bc DE,heuristic,1,1,Gelatina BC de cereza light 18 gr,,
Belleza,heuristic,1,1,Discos de belleza Estrella 80 u,,
Black,heuristic,1,1,Taladro Black & Decker con percutor 10mm 500w,,
Blanca,heuristic,1,1,Pimienta blanca S&P molida  25 gr,,
Boligrafo DE,heuristic,1,1,Repuesto Boligrafo de gel Bic 3 u,,
Bombonett,heuristic,1,1,Huevo de pascua Bombonett con bombones 84 g,,
Bonux DE,heuristic,1,1,Esponja Bonux de fibra lisa,,
Bowl,heuristic,1,1,Set bowl Bonu Hogar + 4 compoteras,,
Bowls,heuristic,1,1,Set de Bowls Bonu Hogar Oval 3 piezas,,
Bronce,heuristic,1,1,Esponja bronce Bonu 16 gr 1 u,,
Bucal,heuristic,1,1,Enjuage bucal Colgate total 12 carbon activado 500 ml,,
Buducco,heuristic,1,1,Tostada Buducco integral 142 g,,
Bulldog,heuristic,1,1,Regaliz Bulldog cintas ácidas 60 g,,
Cafe,heuristic,1,1,TAZA DE CAFE atenas crudo 72 ml,,
Capello,heuristic,1,1,Tender capello grande,,
Caramelo,heuristic,1,1,Salsa de caramelo S&P 350 gr,,
Carnaroli,heuristic,1,1,Arroz carnaroli  Dos hermanos estuche 500 gr,,
Caro,heuristic,1,1,Desodorante Caro Cuore amore x 123 ml,,
Casalta,heuristic,1,1,Vinagre Casalta manzana pet 1 lt,,
Cereales,heuristic,1,1,Galletitas Cereales Bagley salvado 3 u 169 gr,,
Chacabuco,heuristic,1,1,Vino Chacabuco malbec 750 cc,,
Chivas,heuristic,1,1,Whisky Chivas Regal 750 cc,,
Chocolatada LA,heuristic,1,1,Leche chocolatada LA SERENISIMA x1lt,,
Chocolatada LS,heuristic,1,1,Leche chocolatada LS clasica tb x200ml,,
Chocolia,heuristic,1,1,Galletitas Chocolia 170 g,,
Chopp,heuristic,1,1,VASO chopp tankard 473 cc,,
Co,heuristic,1,1,Set co ccion Mu ltiflon 5 piezas  gris,,
Coccion,heuristic,1,1,Set coccion Multiflon 3 piezas negro,,
Coche/cuna/silla,heuristic,1,1,BEBOTE coche/cuna/silla 28cm,,
Cochecito,heuristic,1,1,Bebote con cochecito 31 cm,,
Cocktails,heuristic,1,1,COPA cocktails martini 26ml x4u,,
Cocoa,heuristic,1,1,Bloqueador Cocoa beach invisible f 50 120 ml,,
Coffee,heuristic,1,1,Crema COFFEE MATE original 170 gr,,
Contenedores,heuristic,1,1,Set de contenedores tapa bamboo 4 u,,
Coquitas,heuristic,1,1,Galletitas Coquitas 260 gr,,
Corona NO,heuristic,1,1,Cerveza CORONA botella No Retornable 710 cc,,
Corp,heuristic,1,1,Deo corp AXE black 150 ml,,
Cosecha,heuristic,1,1,Espumante Cosecha Tardia rosado 750 cc,,
Coza,heuristic,1,1,Dispenser Coza para detergente 600 ml,,
Cremoso,heuristic,1,1,Limp cremoso CIF rosas y jazmin x375g,,
Criadores,heuristic,1,1,Whisky Criadores petaca 195 cc,,
Cu4tro,heuristic,1,1,Vino Cu4tro monos locos malbec 750 cc,,
Cubeteado,heuristic,1,1,Tomate cubeteado Salsati 400 gr,,
Cubiertos DE,heuristic,1,1,Set Cubiertos de mesa rojo 16piezas,,
Danielle,heuristic,1,1,Kit Danielle edt.90 ml +jabonera/jabon 75g,,
Deco,heuristic,1,1,Maceta deco plantin 14x14x20,,
Denral,heuristic,1,1,Crema denral Paradonta blanqueadora 116 gr,,
Dentales,heuristic,1,1,Cepillos dentales Colgate premier 1412,,
Desmaquillante Q,heuristic,1,1,Toalla desmaquillante Q Soft vitamina c 25 u,,
Desmineralizada,heuristic,1,1,Agua desmineralizada Silisur 5 lt,,
Dicomere,heuristic,1,1,Harina Dicomere trigo sarraceno sin tacc 450 gr,,
Didactico,heuristic,1,1,Cubo didactico Winfun lado-a-lado,,
Doctor,heuristic,1,1,Aperitivo Doctor Lemon mojito botella 1 lt,,
Dominadas,heuristic,1,1,Barra dominadas Mir Fitness para puerta,,
Dos,heuristic,1,1,Chocolate Dos Corazones 26 gr,,
Dove,heuristic,1,1,Desodorante en barra Dove original 53 g,,
Dulc,heuristic,1,1,Galletitas dulc Cachamai con salvado 165 gr,,
Dulces,heuristic,1,1,Galletitas Dulces Surtidas lata 454 gr,,
Duo,heuristic,1,1,Goma duo Maped 2 u,,
E,heuristic,1,1,Adhesivo E ccole zapatillas 9 gr,,
Ecovita,heuristic,1,1,Apresto Ecovita con aroma lirios 500 ml,,
Eichbaum,heuristic,1,1,Cerveza Eichbaum premium pilsner x 500cc,,
El Pulpito,heuristic,1,1,Pegamento El pulpito sintetico 50 gr,,
Electrico,heuristic,1,1,Generador electrico Philco 2500 w,,
Emergencia,heuristic,1,1,Luz emergencia Ledvance light 2w 765,,
Emeth DE,heuristic,1,1,Bizcochuelo Emeth de vainilla con chip 450 gr,,
Entero LA,heuristic,1,1,Tomate entero La Campagnola lata 400 gr,,
Eskabe,heuristic,1,1,Termotanque Eskabe electrico blanco 95 lt,,
Especial,heuristic,1,1,LEÑA especial Hay Leña x10kg,,
Espumante,heuristic,1,1,Vino espumante Novecento Night etra brut 750 cc,,
Est.,heuristic,1,1,Vino EST. MENDOZA chen/chand.dulce750 cc,,
Ete,heuristic,1,1,Parlante Ete portatil bluetooth E66,,
Faber,heuristic,1,1,Lapiz corrector FABER CASTELL 8 ml,,
Faber-castell DE,heuristic,1,1,Crayon Faber-castell de cera  12 u,,
Fanta,heuristic,1,1,Gaseosa Fanta naranja pet 2.25 lt,,
Fantasia,heuristic,1,1,Cartuchera fantasia 2 pisos,,
Felicity,heuristic,1,1,ALMOHADA felicity 50x70cm,,
Filetto LA,heuristic,1,1,Salsa filetto La Campagnola doypack 340 gr,,
Finca,heuristic,1,1,Vino Finca Magnolia malbec 750 cc,,
Flotadora,heuristic,1,1,Barra flotadora Poly flot,,
Foie,heuristic,1,1,Pate de Foie Jalapeño Swift x 90 g,,
Fragata,heuristic,1,1,Fosforos Fragata tradicional 220 u,,
Froot,heuristic,1,1,Cereal Froot Loops 175 gr,,
Frutales,heuristic,1,1,Anillo frutales Nutrifoods 1 kg,,
Full,heuristic,1,1,CUBRECAMA full queen  gris 229229 cm,,
Garbanzo,heuristic,1,1,Harina de garbanzo Sturla sin taac 250 gr,,
Gaucho,heuristic,1,1,Vino Gaucho malbec 750 cc,,
Gel BI,heuristic,1,1,Alcohol en gel Bi Alcohol neutro 500 ml,,
Geometrico,heuristic,1,1,Set geometrico Pelikan felible 3 piezas,,
Gilette,heuristic,1,1,Maquina Gilette Prestobarba3 Fresh 8 x 6,,
Goicochea,heuristic,1,1,Crema Goicochea diabete 400 ml,,
Goicochea U,heuristic,1,1,Crema Goicochea u ltra nutritiva 400 ml,,
Gran,heuristic,1,1,Fosforos Gran Fragata tradicional x 400 u,,
Grano,heuristic,1,1,Choclo en  grano Inca lata 350 gr,,
Grasa,heuristic,1,1,Bizcochitos de  grasa Jorgito 200 gr,,
Grolsch,heuristic,1,1,Cerveza  grolsch lata 473 cc,,
Guacamole,heuristic,1,1,Salsa guacamole TAU 290 gr,,
Hebras LA,heuristic,1,1,Queso en hebras La Paulina Italiano 4 quesos light x135gr,,
Hesperidina,heuristic,1,1,Aperitivo Hesperidina 1 lt,,
Hibrida,heuristic,1,1,Maquina hibrida Venus sensitive x 2 u,,
Hig.,heuristic,1,1,Papel hig. BONU bco clasico 4 u 50mt,,
Higienioc,heuristic,1,1,Papel higienioc Elegante doble hoja 30mt4 u,,
Hondo,heuristic,1,1,Plato hondo gema plus 6 un,,
Hot,heuristic,1,1,Autos Hot Wheels paquete 5 u,,
Huevos,heuristic,1,1,Caceria de huevos Rocklets caja 20 u 13 g,,
Hum,heuristic,1,1,Toa hum ESTRELLA cuidado relajante x50u,,
Humedas,heuristic,1,1,Toallas humedas antibacteriales Q-Soft 30 u,,
Industrial,heuristic,1,1,Cocina industrial Usman 4 hornallas,,
Inf,heuristic,1,1,Leche inf NUTRILON 4 tb x200ml,,
Inf.,heuristic,1,1,Leche inf. NIDO 3 lis. p/tomar nu.200 ml#,,
Infernales,heuristic,1,1,Vino Infernales malbec 750 cc,,
Inst. LA,heuristic,1,1,Cafe inst. LA VIRGINIA clasico d/p 170g,,
Instantantaneo,heuristic,1,1,Cafe instantantaneo Nescafe Gold blend 100 gr,,
Interdental,heuristic,1,1,Cepillo interdental Oral-B expert 20 u,,
Inverter,heuristic,1,1,Lavasecarropas Inverter 10 kg Blanco,,
J&b,heuristic,1,1,Whisky J&B 750 cc,,
Ja5629 CC,heuristic,1,1,CUCHARON JA5629 cc,,
Ja5668 CC,heuristic,1,1,BATIDOR JA5668 cc,,
Jameson,heuristic,1,1,Whisky Jameson 700/750 cc,,
Jim,heuristic,1,1,Whisky Jim Beam etiqueta blanca 750 cc,,
Juego,heuristic,1,1,Set juego exterior rattan 4 piezas,,
Just,heuristic,1,1,Mochila Just deportiva elemental,,
Kanjihome,heuristic,1,1,Cafetera Kanjihome multicapsula negra,,
Kit,heuristic,1,1,Chocolate Kit Kat oblea clasica x41.5gr,,
Kooky,heuristic,1,1,Bombones KOOKY BON rell. marroc 10 gr,,
Krach-itos,heuristic,1,1,Baston Krach-itos etra queso 300 gr,,
La Lechera,heuristic,1,1,Leche en polvo La Lechera pouch 400 gr,,
La Parmesana,heuristic,1,1,Nuez moscada La parmesana molida 25 gr,,
Lactea,heuristic,1,1,Bebida lactea Sense caramel 200 ml,,
Las Pepas,heuristic,1,1,Perfume Las Pepas Hera edp con vap 100 ml,,
Lavavajillas,heuristic,1,1,Polvo lavavajillas Sun para maquinas x 1 kg,,
Leña,heuristic,1,1,Carbón de leña Hay fuego 4 kg,,
Liliana A,heuristic,1,1,Plancha Liliana a vapor,,
Liliana DE,heuristic,1,1,Caloventor Liliana de pared 2000 w,,
Limol,heuristic,1,1,Jabon Limol secreto cremoso 3 u 90 gr,,
Limpieza,heuristic,1,1,Kit limpieza auto Bonu Hogar 11 piezas,,
Liquido,heuristic,1,1,Baño liquido Johnson baby cabeza y pies 200 ml,,
Lokotoys,heuristic,1,1,Bebote Lokotoys drink con a ccesorios 40 cm,,
Look,heuristic,1,1,Sabanas look 144 hilos algodon 2 1/2 plazas,,
Los Haroldos,heuristic,1,1,Vino Los Haroldos Estate malbec 750 cc,,
Los Helechos,heuristic,1,1,Vino Los helechos cabernet sauvignon reserva 750 cc,,
Lta,heuristic,1,1,Reposera a lta aluminio,,
Lta EL,heuristic,1,1,Ma lta El Pocillo fortificada 170 gr,,
Lta MA,heuristic,1,1,Ma lta MA ltIFE doy pack 125 gr,,
Ltisemillas,heuristic,1,1,Mu ltisemillas Genser mi doypack 150 gr,,
Ltos,heuristic,1,1,Vino A ltos del Plata malbec 750 cc,,
Luces Y,heuristic,1,1,COCINITA con luces y musica verde,,
Mandioca,heuristic,1,1,Fecula de mandioca Dicomere sin tacc 450 gr,,
Manon,heuristic,1,1,Galletitas Manon 182 gr,,
Manteca,heuristic,1,1,Papel manteca Bonu 28 cm 5mt,,
Manzana,heuristic,1,1,Vinagre de manzana S&P 500 cc,,
Maní,heuristic,1,1,Postre de maní S&P 150 g,,
Marco DE,heuristic,1,1,"Espejo con marco DE PINO 53,34 100,08",,
Mata,heuristic,1,1,Cebo mata cucarachas Raid Max x 6,,
Matacucarachas,heuristic,1,1,Jeringa matacucarachas Raid Max 3 gr,,
Melitas,heuristic,1,1,Galletitas Melitas 159 / 170 gr,,
Membrillo LA,heuristic,1,1,Dulce de membrillo La Campagnola 500 g,,
Mercier,heuristic,1,1,Espumante Mercier etra brut 750 cc,,
Mgc,heuristic,1,1,Taladaro MGC percutor 450W,,
Michelob,heuristic,1,1,Cerveza Michelob ultra lata 473 cc,,
Microfibra,heuristic,1,1,Alfombra de microfibra 50 80,,
Mil,heuristic,1,1,Vino Mil Rosas rosado 750 cc,,
Miller,heuristic,1,1,Cerveza Miller lata edicion limitada 473 cc,,
Mirinda,heuristic,1,1,Gaseosa Mirinda naranja pet 2.25,,
Mister,heuristic,1,1,Franela Mister Trapo 1 u,,
Molinos,heuristic,1,1,Snack Molinos Ala cebolla y crema x80g,,
Monster,heuristic,1,1,Energizante Monster Energy 473 cc,,
Mor DE,heuristic,1,1,Banqueta Mor de acero,,
Mostaza,heuristic,1,1,Salsa mostaza con miel Dos Anclas 375 gr,,
Mr,heuristic,1,1,Chupetin Mr Pop s evolution cereza 24 u,,
Mr.musculo,heuristic,1,1,Limpiador Mr.Musculo adhesivo para inodoros limon,,
Multiflon,heuristic,1,1,Sarten Multiflon para crepes y panqueques 18 cm,,
Murville,heuristic,1,1,Vino Murville frizante natural 750 cc,,
My,heuristic,1,1,Perfume MY LITTLE DANIELLE edt x90ml,,
Myborowa,heuristic,1,1,Vodka Myborowa 700 cc,,
Navaro,heuristic,1,1,Espumante Navaro Correas etra brut 750 cc,,
Negra,heuristic,1,1,Pimienta negra Darama molida 500 g,,
Nescao,heuristic,1,1,Cacao Nescao 150 gr,,
Okebon,heuristic,1,1,Galletitas Okebon leche 273 g,,
Old,heuristic,1,1,Whisky Old Smuggler 200 cc,,
Oral-b,heuristic,1,1,Cepillo dental Oral-B kids mickey suave,,
Originario,heuristic,1,1,Vino Originario blanco dulce 750 cc,,
Orloff,heuristic,1,1,Vodka Orloff watermelon 750 cc,,
Osi-osi,heuristic,1,1,Caramelos Osi-Osi masticables frutales 300 g,,
P/peinar,heuristic,1,1,Crema p/peinar SEDAL ceramidas x300ml,,
Palmolive,heuristic,1,1,Jabon en barra Palmolive frambuesa y mora 85 gr,,
Paloma,heuristic,1,1,Perfume Paloma fantasy eau de parfum 100 ml,,
Pamola,heuristic,1,1,Perfume Pamola Herrera eau de parfum 100 ml,,
Papel,heuristic,1,1,Toalla de papel Elite plus 10 x 250 u,,
Parboil LU,heuristic,1,1,Arroz parboil Lu cchetti bolsa 1 kg,,
Parbolizado LU,heuristic,1,1,Arroz parbolizado Lu cchetti 500 gr,,
Parborizado,heuristic,1,1,Arroz parborizado Dos hermanos 5 kg,,
Parrilera,heuristic,1,1,Sal parrilera Celusal 500 gr,,
Pasta,heuristic,1,1,ESPUMADERA de pasta,,
Pecado,heuristic,1,1,Vino Pecado malbec 750 cc,,
Pelada,heuristic,1,1,Almendra pelada Blancanuez 100 gr,,
Pelado,heuristic,1,1,Mani pelado Pehuamar 320 gr,,
Perita,heuristic,1,1,Tomate perita Inca lata 400 grs,,
Picallo,heuristic,1,1,Tender picallo chico,,
Pilar,heuristic,1,1,Galleta Pilar Cream Cracker  307 gr,,
Piso LA,heuristic,1,1,Secador de piso La Gauchita doble goma,,
Pispi,heuristic,1,1,Vino Pispi blend de tintas 750 cc,,
Pizza LA,heuristic,1,1,Salsa pizza La Campagnola doypack 340 gr,,
Planchar,heuristic,1,1,Tabla de planchar forte,,
Plancharpicallo,heuristic,1,1,Tabla de plancharpicallo,,
Planetaria,heuristic,1,1,Batidora PLANETARIA VTL 4.5L 1500W,,
Planetario,heuristic,1,1,Batidora planetario vtl 6l 1800w,,
Plastica LA,heuristic,1,1,Palita plastica La Gauchita,,
Playera,heuristic,1,1,Lona Playera varios colores 90 x 150 cm,,
Playo,heuristic,1,1,Plato playo gema plus 6 u,,
Plmero,heuristic,1,1,Destapacañerias Plmero 1 lt,,
Polyester,heuristic,1,1,Alfombra de polyester 50 80,,
Pomarola LA,heuristic,1,1,Salsa pomarola La Campagnola doypack 340 gr,,
Pond´s S,heuristic,1,1,Crema Pond´s s nutritiva 100 ml,,
Portable,heuristic,1,1,Kit portable Colgate 1 u,,
Portuguesa,heuristic,1,1,Salsa portuguesa Noel doypack 340 gr,,
Premium DE,heuristic,1,1,COMPRESOR PREMIUM de aire 12v,,
Primavera,heuristic,1,1,Mix primavera Inca 350 gr,,
Prune,heuristic,1,1,Perfume Prune III edp con vaporizador 50 ml,,
Prune II,heuristic,1,1,Perfume Prune II edp con vaporizador 50 ml,,
Quara,heuristic,1,1,Vino Quara malbec 750 cc,,
Quemar,heuristic,1,1,Alcohol de quemar Porta 1 lt,,
Queso,heuristic,1,1,Snack queso MOLINOS ALA x80g,,
Raffaello,heuristic,1,1,Bombones Raffaello 3 u,,
Ranch,heuristic,1,1,Salsa ranch Dos Anclas pet 360 gr,,
Red,heuristic,1,1,Energizante Red Bull 250 cc,,
Repostero,heuristic,1,1,Dulce de leche repostero S&P pote 1 kg,,
Repuesto,heuristic,1,1,LAMPAZO repuesto,,
Resposteria,heuristic,1,1,Relleno resposteria Aguila avellana 290 gr,,
Rina,heuristic,1,1,Fideos Rina Matarazzo spaghetti semola 500 gr,,
Rojo,heuristic,1,1,Pimiento rojo Salvita entero x 750 g,,
Ronda,heuristic,1,1,Galletita Ronda hojaldradas 150 gr,,
Roya,heuristic,1,1,Postre Roya chocolate light 40 gr,,
Royacamp DE,heuristic,1,1,Carpa Royacamp de playa 220110110 cm,,
S&p CO,heuristic,1,1,Harina de maiz S&P co ccion rapida 500 gr,,
Sa,heuristic,1,1,Cerveza Sa lta Cautiva rubia lata 473 cc,,
Samantha DE,heuristic,1,1,Cabo Samantha de madera con rosca,,
Sapo DE,heuristic,1,1,Vino Sapo de otro pozo blend de tintas 750 cc,,
Schweppes,heuristic,1,1,Gaseosa Schweppes tonica 1.5 lt,,
Se,heuristic,1,1,Insecticida Se lton MMM nueva formula sin olor 360 cc,,
Sebille,heuristic,1,1,Bombilla Sebille desarmable 1 u,,
Seguridad,heuristic,1,1,"CAJA DE SEGURIDAD electronica 20""",,
Seiseme,heuristic,1,1,Jabon en pan Seiseme 300 gr,,
Sillas,heuristic,1,1,Set de sillas plegables de acero + mesa,,
Skay MU,heuristic,1,1,Paï¿½o Skay mu ltiuso lleva 8 paga 6,,
Slim,heuristic,1,1,REVOLVEDOR Slim 11cm 500un,,
Sobremesa,heuristic,1,1,CUCHARA Sobremesa Blanca 50un,,
Soja,heuristic,1,1,Salsa soja Tahiti bidon 5 lt,,
Solida,heuristic,1,1,Canasta solida Pato marina x 37 g,,
Sopa,heuristic,1,1,Cucharon de sopa,,
Soporte,heuristic,1,1,ALMOHADA soporte firme 50x70cm,,
Sorbo,heuristic,1,1,Lampara Sorbo mata insectos,,
Spiritu,heuristic,1,1,Gin Spiritu Blu 700 ml,,
St.,heuristic,1,1,Jabón tocador St. Tropez frutal glicerina 3 u x 90 grs,,
Stani,heuristic,1,1,Pastillas Stani miel/menta 28 gr,,
Stefi,heuristic,1,1,Muñeca Stefi Love familia xl,,
Stromberg,heuristic,1,1,Auriculares stromberg daus bluetooth,,
Suflair,heuristic,1,1,Chocolate Suflair Nestle 80 gr,,
Summer,heuristic,1,1,Reposera summer fashion,,
Tabla DE,heuristic,1,1,Set Tabla de picar Crom 2 u,,
Tapizados,heuristic,1,1,Limpia tapizados Silisur 320 gr,,
Tarros,heuristic,1,1,Set Tarros Crom tapa rosca 3 un,,
Tau,heuristic,1,1,Mayonesa Tau con aceite de oliva x290gr,,
Terciopelo,heuristic,1,1,Percha terciopelo varios colores x5u,,
Tic-tacmix,heuristic,1,1,Pastillas Tic-Tacmix frutas estuche 16 g,,
Tipo,heuristic,1,1,Salame tipo fuet Cagnoli x150gr,,
Topes,heuristic,1,1,BARRA con topes,,
Transportador,heuristic,1,1,CAMION TRANSPORTADOR con 12 autos,,
Travel,heuristic,1,1,VASO TRAVEL x1.2lt,,
Trazado,heuristic,1,1,Kit trazado Maped 3 piezas 20 cm,,
Trichoc,heuristic,1,1,Pepas trichoc Trio bañadas en chocolate 300 gr,,
Trishot,heuristic,1,1,Alfajor Trishot triple 60 gr,,
Tromen,heuristic,1,1,Atizador tromen accesorio gourmet,,
Trozos,heuristic,1,1,Champignon trozos S&P lata 400 gr,,
Tthe,heuristic,1,1,Whisky Tthe famous grouse finest 700 cc,,
Turbo,heuristic,1,1,"Ventilador turbo Liliana 18""",,
Untable,heuristic,1,1,Relleno untable Bon o Bon x290gr,,
Uva,heuristic,1,1,Pasa de uva Pasablanca 150 gr,,
Valeria,heuristic,1,1,Perfume Valeria eau de parfum 100 ml,,
Valijas,heuristic,1,1,Set X 3 valijas rigidas gris 20 24 28,,
Vallisto,heuristic,1,1,Vino Vallisto viejas blancas 750 cc,,
Vasos,heuristic,1,1,Pack vasos point Durax x 6 un,,
Vegana,heuristic,1,1,Mayonesa vegana Hellmanns doy pack 250 gr,,
Vegetal,heuristic,1,1,Leche vegetal Silk almendra endulzada 1 lt,,
Verde LA,heuristic,1,1,Te verde La Virginia 20 saquitos,,
Verduras,heuristic,1,1,Escurridor verduras Crom,,
Vidrio,heuristic,1,1,Mesa de vidrio redonda con base de acero,,
Viñas DE,heuristic,1,1,Vino Viñas de Balbo tinto 1.125 lt,,
Vtl,heuristic,1,1,CAFETERA VTL Expresso Vintage 1.5L,,
Warsteiner,heuristic,1,1,Cerveza Warsteiner lata german pilsener 473 cc,,
White,heuristic,1,1,Whisky White Horse scotch blended 750 cc,,
Yüka,heuristic,1,1,Fideos YÜKA tirabuzón s/tacc x250gr,,
Zuco,heuristic,1,1,ESCALERA Zuco 2 escalones aluminio,,
Ñuke,heuristic,1,1,Parrila Ñuke alamo 100,,
3d,lookup,1,1,Conos 3D Mega queso 143/150 gr,,
Ades,lookup,1,1,Jugo Ades manzana 1 lt,,
Alka,lookup,1,1,Caramelos Alka strong 800 gr,,
Amarula,lookup,1,1,Licor Amarula crema 750 cc,,
Astra,lookup,1,1,Maquina afeitar Astra,,
Atma,lookup,1,1,Cocina Atma multigas negra 56 cm,,
Bagley,lookup,1,1,Galletitas Bagley salvado 214 gr,,
Baileys,lookup,1,1,Licor Baileys 750 cc,,
Bari,lookup,1,1,Leche barista La Serenisima parcialmente descremada 1 lt,,
Baron B,lookup,1,1,Espumante Baron B etra brut 750 cc,,
Benedictino,lookup,1,1,"Agua BENEDICTINO sin gas x2,25lt",,
Boca,lookup,1,1,Bocaditos Granix relleno frutilla 180 g,,
Borghetti,lookup,1,1,Licor Borghetti cafe 700 cc,,
Box,lookup,1,1,Boxer termico Dufour s/costura sin costura t2 T3 T4 T5,,
Buenas y Santas,lookup,1,1,Yerba Buenas y Santas 500 gr,,
Buhero,lookup,1,1,Fernet Buhero Negro 700 cc,,
Candela,lookup,1,1,Encendedor Candela transparente,,
Capri,lookup,1,1,Fernet Capri 750 cc,,
Cazador,lookup,1,1,Vino Cazador malbec 750 cc,,
Coffe Mate,lookup,1,1,Crema Coffe Mate lite 170 gr,,
Cosmos,lookup,1,1,Chupetin Cosmos Mega surtido 24 u,,
Crandall,lookup,1,1,Perfume Crandall legend 90 ml,,
Cuca,lookup,1,1,Mata cucarachas Raid x 360 cc,,
Cuernavaca,lookup,1,1,Licor Cuernavaca etra seco 1 lt,,
Curita,lookup,1,1,Apositos CURITAS tela elastica 20 u#,,
Desafio,lookup,1,1,Palillero Desafio 12 u 50 u,,
Dilema,lookup,1,1,Vino Dilema pink 750 cc,,
Dolca,lookup,1,1,Bocadito DOLCA bananita x30g,,
Domino,lookup,1,1,Azucar Domino 1 kg,,
Don Nicanor,lookup,1,1,Vino Don Nicanor malbec 750 cc,,
Dulcor,lookup,1,1,Mermelada Dulcor ciruela 500 gr,,
El Pocillo,lookup,1,1,Malta El Pocillo fortidicada doypack 115 grs,,
Etchart,lookup,1,1,Vino Etchart Privado torrontes 750 cc,,
Etiquet,lookup,1,1,Antitranspirante Etiquet rolit original men roll-on60 gr,,
Express,lookup,1,1,Cafetera express Liliana 3en1 c/accesor.,,
Fritolim,lookup,1,1,Aceite Fritolim manteca aerosol 120 cc,,
Frizze,lookup,1,1,Coctel Frizze evolution blue new 1 lt,,
Full Mani,lookup,1,1,Chocolate Full Mani con leche/mani 45 gr,,
Fun,lookup,1,1,Gomitas Fun Dipperz gel ácido 54 g,,
Garoto,lookup,1,1,Bombones Garoto surtidos 250/300 gr,,
Genio,lookup,1,1,Alfajor Genio triple blanco x60gr,,
Go Natural,lookup,1,1,Granola Go Natural 290 g,,
Golondrina,lookup,1,1,Velas Golondrina 120 gr,,
Havana,lookup,1,1,Ron Havana añejo 3 años 750 cc,,
Heinz,lookup,1,1,Mayonesa Heinz original doy pack 350 gr,,
Hojalmar,lookup,1,1,Galletitas Hojalmar larguitas ronda 150 grs,,
Il Caprone,lookup,1,1,Vino Il Caprone malbec 750 cc,,
Jack,lookup,1,1,Whisky Jack Daniel's  honey 750 cc,,
Jelly Roll,lookup,1,1,Gomitas Jelly Roll 1 kg,,
Kinder,lookup,1,1,Huevo Kinder joy sorpresa 20 gr,,
La Gauchita,lookup,1,1,Plumero La Gauchita limpiatecho,,
La Morenita,lookup,1,1,Capsulas La Morenita cafe honduras nespresso 10 u,,
La Paulina,lookup,1,1,Dulce de leche La Paulina familiar 400 gr,,
La Quesera,lookup,1,1,Rallado La Quesera 8 grs,,
La Yapa,lookup,1,1,Pastillas La Yapa surtido 17 gr,,
Lenguetazo,lookup,1,1,Caramelo LENGUETAZO tutti frutti 32ux13g,,
Levex,lookup,1,1,Levadura Levex sobre 2u x 10gr,,
Liebig,lookup,1,1,Yerba Liebig original 500  gr,,
Lira,lookup,1,1,Aceite Lira maiz 900 ml,,
Los Arboles,lookup,1,1,Vino Los Arboles malbec 750 cc,,
Los Intocables,lookup,1,1,Vino Los Intocables cabernet 750 cc,,
Macucas,lookup,1,1,Galletitas Macucas chocolate 110 gr,,
Malibu,lookup,1,1,Ron Malibu coctel coco 750 cc,,
Melitta,lookup,1,1,Filtro Melitta de papel prensado n°4,,
Merengada,lookup,1,1,Galletitas Merengadas frutilla 93 gr,,
Nido,lookup,1,1,Leche entera Nido organica 800 gr,,
Nobleza Gaucha,lookup,1,1,Yerba Nobleza Gaucha sele ccion 500 gr,,
Norton,lookup,1,1,Vino Norton barrel select malbec 750 cc,,
Nucete,lookup,1,1,Aceitunas Nucete negras light frasco 360 gr,,
