brand,brand_source,products_count,unique_names_count,sample_1,sample_2,sample_3
S&p,heuristic,79,79,Adobo S&P para pizza 25 gr,Aji S&P molido 25 gr,Almohaditas S&P relleno  frutilla 200 gr
Dove,lookup,75,75,Acondicionador Dove aregeneracion etrema 400 ml,Acondicionador Dove bond intense repair 250 ml,Acondicionador Dove brillo 400 ml
Ace,lookup,68,68,Aceite  oliva La Toscana ajo  botella250 cc,Aceite  oliva La Toscana albahaca botella 250 cc,Aceite bebe Johson 100 ml
Sedal,lookup,64,63,Acondicionador Sedal  balance sachet 10 ml,Acondicionador Sedal S.O.S crema balsamo doy pack 300 ml,Acondicionador Sedal ceramidas 190 ml
Rexona,lookup,52,52,Antitranspirante Rexona Clinical extra dry 91 gr,Antitranspirante Rexona Clinical for women barra 48 gr,Antitranspirante Rexona Clinical soft scent 48 gr
Femeninas,heuristic,50,50,Toallas femeninas Always dia suave 16 u,Toallas femeninas Always dia suave 8 u,Toallas femeninas Always noche suave 16 u
Colgate,lookup,50,50,Cepillo dental Colgate 360 promo 21,Cepillo dental Colgate Premier 1 u,Cepillo dental Colgate clasico suave
Cif,lookup,48,48,Ballerina Cif multiuso,Desinfectante Cif floral aerosol 360 cc,Desinfectante Cif frescura citrica aerosol 360 cc
Bols,lookup,46,46,BOLSA ECOLOGICA amigos 6040 cm,BOLSA ECOLOGICA recicla roja 4540 cm,BOLSA ECOLOGICA reutiliz.amar. 4540 cm
Pro,lookup,46,46,Aperitivo PRONTO SHAKE x1lt,Aperitivo Pronto Shake lata 473 cc,Aperitivo Pronto bitt lata 473 cc
Para,heuristic,44,44,Alimento para Gato Whiskas sabor carne gatitos pouch 85 gr,Alimento para gato Cat Chow adu ltos pescado sobre 85 gr,Alimento para gato Cat Chow adu ltos pollo sobre 85 gr
Polvo,heuristic,41,41,Helado en polvo Exquisita vainilla 52/55 gr,Jugo en polvo Arcor anana 15 g,Jugo en polvo Arcor limonada 18/20 gr
Ala,lookup,41,41,Desodorante Alagabo polvo suave rosa 180 gr,Jabon Ala Camellito Matic ropa fina doy pack 450 cc,Jabon Ala Camellito Matic ropa fina doy pack 900 cc
Poett,lookup,40,40,Canasta Poett pastillas surtidas  aparato,Canasta Poett pastillas surtidas repuesto,Desinfectante Poett flores primavera 900 ml
Ayudin,lookup,38,38,Desinfectante Ayudin bebe aerosol 332 cc,Desinfectante Ayudin matinal aerosol 332 cc,Desinfectante Ayudin original aerosol 332 cc
Bonux,heuristic,37,37,Esponja Bonux cuadraditos,Esponja Bonux rollito acero 42 gr c/u 6 u,Esponja Bonux rollito acero 70 grc/u 10 u
Plusbelle,lookup,37,37,Acondicionador Plusbelle brillo luminoso 1 lt,Acondicionador Plusbelle esencia brillo 700 ml,Acondicionador Plusbelle esencia brillo perfecto 700mll
Kevin,lookup,31,31,After shave Kevin 60 ml,Antitranspirante Kevin black 177 gr,Antitranspirante Kevin u ltra seco sin alcohol 177 gr
Ciel,lookup,30,30,Colonia Ciel 250 ml,Colonia Ciel Shine 250 ml,Colonia Ciel eau de cologne crystal 250 ml
Nivea,lookup,29,29,After shave Nivea Men balsamo sensitive 100 ml,Antitranspirante Nivea Men deep darkood aerosol 150 ml,Antitranspirante Nivea Men derma control sensitive aerosol 150 ml
Ambiente,heuristic,26,25,Aromatizante ambiente Glade Automatico caricias de algodon repuesto 175 gr,Aromatizante ambiente Glade Automatico lavanda vainilla repuesto 175 gr,Aromatizante ambiente Glade Automatico paraiso azul repuesto 175 gr
Babysec,lookup,25,25,Pañal BABYSEC Ultra Soft jumbo G x60u,Pañal Babysec Premium Flexible hiper XG 32/36 u,Pañal Babysec Premium hiper G 40/44 u
Knorr,lookup,24,24,Caldo Knorr carne deshidratado 12 u,Caldo Knorr carne deshidratado 2 u,Caldo Knorr gallina deshidratada 2 u
Tresemme,lookup,24,24,Acondicionador Tresemme brillo lamelar 500 ml,Acondicionador Tresemme brillo lamelar 880 ml,Acondicionador Tresemme caut reparadora 250 ml
Pascua,heuristic,23,23,Conejo de pascua Bariloche de chocolate 36 gr,Conejo de pascua Bariloche de chocolate 96 gr,Conejo de pascua Bon o BON blanco 50 gr
Saborizada,heuristic,23,23,Agua saborizada Aquarius manzana 2.25 lt,Agua saborizada Aquarius naranja 1.5 lt,Agua saborizada Aquarius pera 1.5 lt
Procenex,lookup,23,23,Limpiador Procenex  fragancia jazmin 1.8 lt,Limpiador Procenex  fragancia lavanda 900 cc,Limpiador Procenex baÃ±o espuma activa doy pack 420 cc
Arcor,lookup,22,22,Bombones ARCOR el kiosco en casa 246 gr,Calavera Arcor halloween 350 gr,Caramelo ARCOR mix cristales 810 g
Hileret,lookup,22,22,Azucar Hileret light 250 gr,Azucar Hileret light 500 gr,Edulcorante Hileret Stevia en sobre 100 u
Algabo,lookup,21,21,Acondicionador Algabo Zero piojos x 500 ml,Acondicionador Algabo baby extra suave x 444 ml,Acondicionador Algabo baby manzanilla x 444 ml
Bic,lookup,21,21,BICICLETA FIJA spinning,Boligrafo Bic cristal azul,Encendedor Bic ez reach x 16 u
Head & Shoulders,lookup,21,21,Acondicionador Head & Shoulders manzana fresh 300/400 ml,Acondicionador Head & Shoulders prote ccion caida 300 ml,Acondicionador Head & Shoulders revitalización argan 300 ml
Si,lookup,21,21,Agua sin gas Cellier 600cc,Limpiador Silvo metales 200 ml,SECAPLATOS sinovoe plegable 3728 cm
Instantaneo,heuristic,20,20,Cafe instantaneo Arlistan frasco 100 gr,Cafe instantaneo Arlistan frasco 50 gr,Cafe instantaneo Arlistan sustentable 170 gr
Pampers,lookup,20,20,Pañal Pampers Babydry mes de uso G 72 u,Pañal Pampers Babydry mes de uso M 72 u,Pañal Pampers Babydry mes de uso XG 58 u
Infantil,heuristic,19,19,COCINA INFANTIL con sonido y a ccesorios,GIMNASIO INFANTIL jungla,Leche infantil Bebe Advanced 2 lata 800 grs
Estrella,lookup,19,18,Algodon Estrella super 100 gr,Algodon Estrella super 200 gr,Algodon Estrella super 400 gr
Exquisita,lookup,19,19,Bizcochuelo Exquisita de chocolate540 gr,Bizcochuelo Exquisita de coco 540 gr,Bizcochuelo Exquisita de limon 540 gr
Arroz,heuristic,18,18,Crackers de arroz Molinos Ala x100gr,Galletas arroz Dos Hermanos con sal 100 gr,Galletas arroz Dos Hermanos dulce 100 gr
Led,heuristic,18,18,Lampara led Ledvance classic 12w luz calida,Lampara led Ledvance classic 12w luz fria,Lampara led Ledvance classic 14w luz calida
Alicante,lookup,18,18,Bicarbonato Alicante de sodio50 gr,Comino Alicante molido 50 gr,Condimento ALICANTE para pizza 50 gr
Mama Cocina,lookup,18,18,Bizcochuelo Mama Cocina chocolate sin tacc 450 g,Bizcochuelo Mama Cocina de chocolate 540 gr,Bizcochuelo Mama Cocina de limon 540 gr
Heroe,heuristic,17,16,Jabon liquido Heroe 1.5 lt,Jabon liquido Heroe bio evolution x1.5lt,Jabon liquido Heroe doy pack 3 lt
Tv,heuristic,17,17,"""Smart TV Bgh 43""""""","""Smart TV Bgh 50""""""","""Smart TV Noble 4k 58"""""""
9 de Oro,lookup,17,17,Alfajor 9 de oro blanco 6 u 45 g,Alfajor 9 de oro chocolate con ddl 6 u 45 g,Bizcochos 9 DE ORO agridulces azucarados 200 gr
Blem,lookup,17,17,Cera BLEM ceramicos incoloro doy pack 450 ml,Cera Blem ceramicos acrilico botella 800 ml,Cera Blem ceramicos floral doy pack  450 ml
Elvive,lookup,17,17,Acond ELVIVE Glycolic Gloss x400ml,Acond ELVIVE Glycolic Gloss x750ml,Acondicionador Elvive color-vive 200 ml
Pantene,lookup,17,17,Acond PANTENE keratina x510ml,Acondicionador Pantene Pro-V equilibrio 400 ml,Acondicionador Pantene Pro-V equilibrio 700 ml
Virulana,lookup,17,17,Balde Virulana con escurridor 12 lt,Cabo Virulana metalico,Escoba Virulana multiuso x 1
Grafo,heuristic,16,16,Boli grafo Bic cristal azul 3 u,Boli grafo Bic cristal escritura fina surtido 3 u,Boli grafo Bic cristal ne gro
Mesa,heuristic,16,16,"""Ventilador de mesa Liliana aspas plasticas 16,5""""""",Agua mesa S&P baja en sodio bidon 6/6.5 lt,Agua mesa S&P bidon 6/6.5 lt
Glade,lookup,16,16,Aromatizante Glade Aceite vainilla x 21 ml,Aromatizante Glade Auto Sport limon refrescante repuesto,Aromatizante Glade Auto Sport repuesto
Huggies,lookup,16,16,Pañal HUGGIES Flexi Confort XXG x30u,Pañal HUGGIES Natural care G x40 u,Pañal HUGGIES classic M x44u
Lysoform,lookup,16,16,Desinfectante Lysoform aire de montaña 360cc,Desinfectante Lysoform aires de montaña 495 cc,Desinfectante Lysoform bebe 360 cc
Noel,lookup,16,16,Atun Noel desmenuzado agua 170 gr,Choclo Noel amarillo cremoso 300 gr,Dulce de batata Noel cajon 5 kg
Raid,lookup,16,16,Aparato RAID liquido electrico+repuesto,Aparato Raid economico + 4 u tabletas rapida a ccion,Espirales Raid 12 u
Fina,heuristic,15,15,Sal fina Celusal estuche 500 gr,Sal fina Celusal light estuche 500 gr,Sal fina Celusal light paquete 470 gr
Pato,lookup,15,15,Canasta Pato Liquida lavanda repuesto 50 cc,Canasta Pato liquida citrus aparato + repuesto x 50 ml,Canasta Pato liquida floral repuesto x 50 ml
Terma,lookup,15,15,Amargo Terma cero cuyano 1.35 lt,Amargo Terma cero limon 1.35 lt,Amargo Terma cero manzana 1.35 lt
Largo,heuristic,14,14,Arroz largo fino 00000 Primor 1 kg,Arroz largo fino 53  1 kg,Arroz largo fino 53 500 gr
Baggio,lookup,14,14,Jugo Baggio Fresh manzana 200 cc,Jugo Baggio Fresh mu ltifruta 200 cc,Jugo Baggio Fresh mu ltifruta nuevo 1 lt
Bahia,lookup,14,14,Anana Bahia en rodajas 850 gr,Arandanos Bahia en almibar 520 gr,Atun BAHIA desmenuzado al natural 170 gr
Comfort,lookup,14,14,Suavizante Comfort 5 lt,Suavizante Comfort Classic doy pack 900 cc,Suavizante Comfort Concentrado original doy pack 1 lt
Danica,lookup,14,14,Ketchup Danica de fiesta 220 gr,Ketchup Danica sch 192 u 8 g,Ketchup Danica tomate huerta 220 gr
Hellmanns,lookup,14,14,Ketchup HELLMANNS sachet 196 u 8 gr(BAJA),Ketchup Hellmanns vegano doy pack 250 gr,Ketchup Hellmanns vegano doy pack 500 gr
La Campagnola,lookup,14,14,Atun La Campagnola al natural 170 gr,Atun La Campagnola al natural 300 gr,Atun La Campagnola en aceite 170 gr
Ledesma,lookup,14,14,Azucar Ledesma 1 kg,Azucar Ledesma light 500 gr,Azucar Ledesma mascabo rubio 800 gr
Mogul,lookup,14,14,Caramelos Mogul ext palotes sandia 120gr,Gomitas Mogul  ext tub frutilla 70 gr,Gomitas Mogul  ext tub tutti frutti 70 gr
Sensodyne,lookup,14,14,Cepillo Sensodyne complete´protection,Cepillo dental Sensodyne complete protection suave,Cepillo dental Sensodyne protección completa suave x2u
Skip,lookup,14,14,Jabon en polvo Skip baja espuma 10 kg,Jabon en polvo Skip baja espuma 2.5 kg,Jabon en polvo Skip baja espuma 600 gr
Suave,lookup,14,14,Acondicion Suave bomba deliciosa 930 ml,Acondicionador Suave bomba ceramidas 930 ml,Acondicionador Suave bomba frutal 930 ml
Vanish,lookup,14,14,Quitamanchas Vanish Oi A. blanco en polvo doy pack 450,Quitamanchas Vanish Oi A. en polvo doy pack 450,Quitamanchas Vanish Oi A. ropa blanca 850 gr
Cereal,heuristic,13,13,Barra Cereal Fort 23 gr,Barra Cereal Fort chocolate/almendras 19 gr,Barra Cereal Fort frutilla light 21 gr
Exito,heuristic,13,13,Cuaderno Exito espiral tapa dura rayado 21 x 27 60 hojas,Cuaderno Exito tapa dura forrado azul cuadriculado 16 x 21 48 h,Cuaderno Exito tapa dura forrado azul cuadriculado Nï¿½3 48 hojas
Johnson,heuristic,13,13,Acondicionador Johnson Baby clasico 400 ml,Acondicionador Johnson Baby manzanilla claro 200 ml,Acondicionador Johnson Baby original 200 ml
Luchetti,heuristic,13,13,Fideo Luchetti ave maria 500 gr,Fideo Luchetti cabello angel 500 gr,Fideo Luchetti coditos 500 gr
Bariloche,lookup,13,13,Huevo de pascua Bariloche 60/70 gr,Huevo de pascua Bariloche de chocolate con leche 2 u 22 gr,Huevo de pascua Bariloche de chocolate con leche 22 gr
Cbse,lookup,13,13,Yerba CBSE  silueta hierbas naturales 500  gr,Yerba CBSE energia guarana 500  gr,Yerba CBSE frutos del bosque 500  gr
Elite,lookup,13,13,Bobina ELITE plus doble hoja 2u 400mt,Elite Mairollo rollo de cocina doble hoja 120 paños,Papel higienico ELITE cuidad clásico hoja simple 12 x 30 m
La Virginia,lookup,13,13,Cafe La Virginia Capuccino instantaneo 10 sobres,Café La Virginia capsulas equilibrio nespresso 10 u,Café La Virginia capsulas sutil nespresso 10 u
Matarazzo,lookup,13,13,Fideo Matarazzo ave maria 500 gr,Fideo Matarazzo cabello angel 500 gr,Fideo Matarazzo codos rayado500 gr
Taragui,lookup,13,13,Mate cocido Taragui fi ltro diamantado sin ensobrar 25 u,Mate cocido Taragui fi ltro diamantado sin ensobrar 50 u,Mate cocido Taragui niños 20 saquitos
317,heuristic,12,12,Tintura 317 kit 0.11 negro azulado,Tintura 317 kit 0.5 rojo fuego,Tintura 317 kit 1 negro intenso
Color,heuristic,12,12,Kit color ISSUE proeccion keratina N8.3 rubio ceniza,Kit color ISSUE prot kera N4 castaño,Kit color ISSUE prot kera N6.73 chocolate dorado
Emeth,heuristic,12,12,Dulce de batata Emeth cajon 5 kg,Dulce de batata Emeth con chocolate pouch 500 gr,Dulce de batata Emeth pouch 500 gr
Isotonica,heuristic,12,12,Bebida Isotonica Gatorade  frutos tropicales 1.25 lt,Bebida Isotonica Gatorade cool blue 1.25 lt,Bebida Isotonica Gatorade cool blue 500 cc
Perro,heuristic,12,12,Alimento Perro Dog Chow adultos pequeños pollo y carne 8 kg,Alimento perro DOGUI adu ltos 15 kg,Alimento perro DOGUI adu ltos 3 kg
Billiken,lookup,12,12,Caramelos Billiken frutal 600 gr,Caramelos Billiken yoghurt 600 gr,Gomitas BILLIKEN gotitas de amor 35 gr
Don Satur,lookup,12,12,Bizcochos Don Satur a gridulces 200 gr,Bizcochos Don Satur negritos x200gr,Bizcochos Don Satur salados 200 gr
Dos Anclas,lookup,12,12,Adobo Dos Anclas pizza 25 gr,Azucar Dos Anclas impalpable 300 gr,Bicarbonato Dos Anclas 25 gr
Elegante,lookup,12,12,Papel higienico Elegante Max hoja simple 80mt 4 u,Papel higienico Elegante aloe vera hoja simple 30mt 6 u,Papel higienico Elegante blanco hoja simple 120 mt 4 u
Listerine,lookup,12,12,Enjuague Bucal LISTERINE cool mint 500 ml,Enjuague bucal LISTERINE ZERO anti caries sin alcohol 500 ml,Enjuague bucal Listerine Zero / cool mint sin alcohol 250 ml
Natura,lookup,12,12,Aceite Natura vegetal aerosol 120g,Ketchup Natura 3 kg,Mayonesa Natura bolsa 3 kg
Pureza,lookup,12,12,Harina Pureza 0000 ultra refinada 1 kg,Harina Pureza con levadura para pan casero 1 kg,Harina Pureza con levadura para pizza 1 kg
Zorro,lookup,12,12,Detergente Zorro U ltra limon original 500 ml,Detergente Zorro U ltra menta/alga 300 ml,Detergente Zorro U ltra menta/alga 500 ml
Gato,heuristic,11,11,Alim. gato CAT CHOW adul. pescado pollo 3 kg,Alimento gato Cat CHow adu lto carne pollo8 kg,Alimento gato Cat Chow adu lto carne/pollo 3 kg
L,heuristic,11,11,Tintura L eau vive kit estuche n 1,Tintura L eau vive kit estuche n 11,Tintura L eau vive kit estuche n 3
Yummy,heuristic,11,11,Gomitas YUMMY moritas 150 gr,Gomitas YUMMY moritas x500gr,Gomitas Yummy 100pies x500gr
Colbert,lookup,11,11,Desodorante Colbert Noir aerosol 150 cc,Desodorante Colbert Noir aerosol 250 cc,Desodorante Colbert Us aerosol 150 cc
Mana,lookup,11,11,Galletitas Mana clasica 3 u 131/136 gr,Galletitas Mana relleno chocolate 165 gr,Galletitas Mana relleno frutilla 165 gr
Humeda,heuristic,10,10,Toalla humeda Babysec ultra fresh 50 u,Toalla humeda Estrella Baby cuidado diario 50 u,Toalla humeda Estrella humectación sensib. 50 u
Axe,lookup,10,10,Desodorante AXE bodyspay dark temptation 97 gr,Desodorante Axe aqua citrus (sa/ene) 150 ml,Desodorante Axe blue lavender (men/am) 150 ml
Bon o Bon,lookup,10,10,Bombon Bon o Bon blanco 30 u15 gr,Bombon Bon o Bon leche 30 u15 gr,Huevo de pascua Bon o Bon 30 u x 10 gr
Cusenier,lookup,10,10,Licor Cusenier cafe al cognac 200 cc,Licor Cusenier cafe al cognac 700 cc,Licor Cusenier chocolate 700 cc
Del Valle,lookup,10,10,Fresa Del Valle lata 473 cc,Jugo DEL VALLE durazno 200 cc#,Jugo DEL VALLE manzana 200 cc
Dolce Gusto,lookup,10,10,Capsulas Dolce Gusto americano 10 u,Capsulas Dolce Gusto cafe au lait descremado 10 u,Capsulas Dolce Gusto capuccino 10 u
Favorita,lookup,10,10,Bizcochuelo Favorita vainilla 450  gramos,Fideo Favorita codito 500 gr,Fideo Favorita dedalitos 500 gr
Higienol,lookup,10,10,Papel Higienico Higienol fresh 40u x 30 mt,Papel Higienico Higienol fresh 4u 30 mt,Papel higienico Higienol Max 4 u 80 mt
Lasfor,lookup,10,10,Almohadita Lasfor relleno avellana 200 gr,Almohadita Lasfor relleno chocolate suizo 180/200 gr,Almohadita Lasfor relleno de avellanas 2.5 kg
Royal,lookup,10,10,Bizcochuelo Royal de chocolate 500 gr,Crema Royal chantilly en polvo 50 gr,Flan Royal de vainilla  60 gr
Santa Julia,lookup,10,10,Espumante Santa Julia cuvee 750 cc,Vino SANTA JULIA tardio blanco 500 cc,Vino Santa Julia cabernet 750 cc
Smirnoff,lookup,10,10,Aperitivo Smirnoff ice  green lata 473 cc,Aperitivo Smirnoff ice lata 473 cc,Aperitivo Smirnoff ice red lata 473 cc
Ambiental,heuristic,9,9,Aromatizante ambiental Glade Automatico lavanda y vainilla aparato,Aromatizante ambiental Glade aceite natural mito aparato 21 cc,Aromatizante ambiental Glade campos de lavanda 380 cc
Carmel,heuristic,9,9,Hisopos Carmel 100 u,Jabon Carmel crema 3 u 90 gr,Jabon Carmel rosa  125 gr
Molido LA,heuristic,9,9,Cafe molido La Morenita clasico intenso 1 kg,Cafe molido La Morenita clasico intenso 125 gr,Cafe molido La Morenita clasico intenso 250 gr
Pedico,heuristic,9,9,Desodorante pedico Reona Efficient original 153 ml,Polvo pedico Algabo 100 gr,Polvo pedico Algabo 200 gr
Vajilla,heuristic,9,9,SET VAJILLA corona cosmic 16 pza,SET VAJILLA corona nectar 16 pza,SET VAJILLA corona solei 16 pza
Cachamai,lookup,9,9,Galletitas Cachamai avena y pasas 166 gr,Te Cachamai amarillo 20 saquitos,Te Cachamai boldo 20 saquitos
Emilia,lookup,9,9,Espumante Emilia dulce 750 cc,Espumante Emilia etra brut 750 cc,Vino EMILIA dulce moscatel x750cc
Federico de Alvear,lookup,9,9,Espumante Federico De Alvear spritz 750 cc,Espumante Federico De Alvear strawberry 750 cc,Espumante Federico De Alvear sweet 750 cc
Granby,lookup,9,9,Jabon en polvo Granby lavado a mano limon 3 kg,Jabon en polvo Granby lavado a mano rosas 3 kg,Jabon en polvo Granby matic limon 3 kg
Hinds,lookup,9,9,Antitranspirante Hinds delicious roll-on 60 gr,Crema Hinds de almendras 250 ml,Crema Hinds para manos intrahidratante 90 ml
Inca,lookup,9,9,Arvejas Inca en lata 350 gr,Durazno Inca en mitades 820 grs,Garbanzos Inca en lata 350 gr
Media Naranja,lookup,9,9,Franela Media Naranja clasica 4050 cm,Paño Media Naranja amarillo absorbente 1 u,Rejilla Media Naranja lavacoches
Morixe,lookup,9,9,Aceitunas Morixe enteras doypack 300 gr,Avena Morixe instantanea 400 gr,Bizcochuelo Morixe vainilla 540 gr
Pehuamar,lookup,9,9,Maicitos Pehuamar 265 gr,Mani Pehuamar pelado 135 gr,Papas fritas Pehuamar acanaladas 135 gr
Riera,lookup,9,9,Grisin Riera integral con semillas 160 gr,Grisin Riera sesamo 160 gr,Grisin Riera tradicional 160 gr
Ser,lookup,9,9,Servilletas Bonux 3333 cm 140 u,Servilletas Bonux 3333 cm 40 u,Servilletas Bonux 3333 cm 70 u
Vim,lookup,9,9,Canasta Vim 3en1 citrus 35 gr,Canasta Vim 4 en 1 oceano 35 gr,Canasta Vim poder x6 lavanda 55 gr
Vivere,lookup,9,9,Suavizante Vivere Clasico doy pack 900 cc,Suavizante Vivere Clasico mas intenso doy pack 900 cc,Suavizante Vivere clasico mas intenso doy pack 3 lt
Coca,heuristic,8,8,Gaseosa Coca Cola lata 354 cc,Gaseosa Coca Cola pet 1.5 lt,Gaseosa Coca Cola pet 2.25 lt
Gruesa,heuristic,8,8,Sal  gruesa Celusal 500 gr,Sal  gruesa Celusal estuche 1 kg,Sal  gruesa Celusal paquete 1 kg
Larga,heuristic,8,8,Leche Larga Vida La Serenisima descremada 1% vitaminas botella 1 lt,Leche Larga Vida La Serenisima descremada zero botella 1 lt,Leche Larga Vida La Serenisima entera 2% vitaminas botella 1 lt
Mini,heuristic,8,8,Galletitas Mini Mantecadas 170 gr,Galletitas Mini Pitusas black 130 g,Galletitas Mini Pitusas chocolate 160 gr
Mumm,heuristic,8,8,Espumante Mumm Cuvee demi sec 750 cc,Espumante Mumm Cuvee etra brut 750 cc,Espumante Mumm Cuvee leger  750 cc
Tres,heuristic,8,8,Amargo Tres Torres blanco 1.5 lt,Amargo Tres Torres limon 1.5 lt,Amargo Tres Torres limon 2 lt
Butter Toffees,lookup,8,8,Caramelos BUTTER TOFFEES chocolate 80 g,Caramelos BUTTER TOFFEES leche  80 g,Caramelos BUTTER TOFFEES surtidos 80 g
Cachamate,lookup,8,8,Yerba Cachamate 1 kg,Yerba Cachamate amarilla 500  gr,Yerba Cachamate coco 500 gr
Cafayate,lookup,8,8,Vino Cafayate cabernet 750 cc,Vino Cafayate chenin torrontes 750 cc,Vino Cafayate malbec nuevo 750 cc
Cereal Mix,lookup,8,8,Barra Cereal Mix chocolate 48% cacao 38 gr,Barra Cereal Mix frutilla y chocolate 26 gr,Barra Cereal Mix yogurt frutilla light 26/28 gr
Flyn,lookup,8,8,Caramelos Flynn Paff frutilla 128 gr,Caramelos Flynn Paff surtidos 128 gr,Caramelos Flynn Paff tutti frutti 128 gr
Gomes Da Costa,lookup,8,8,Atun Gomes Da Costa desmenuzado al natural 170 gr,Atun Gomes Da Costa desmenuzado en aceite 170 gr,Atun Gomes Da Costa filete en oliva 125 gr
Lux,lookup,8,8,Jabon Lux delicadeza de jazmin 3 u 120/125 gr,Jabon Lux frescura de lirio azul 3 u 120/125 gr,Jabon Lux jazmin cremoso 120/125 gr
Mach 3,lookup,8,8,Maquina afeitar Mach 3 Sensitive,Maquina afeitar Mach 3 Turno,Maquina afeitar Mach 3 charcoal cartucho 2 u
Maggi,lookup,8,8,Caldo Maggi carne 12 u,Caldo Maggi carne polvo 5u 35 gr,Caldo Maggi gallina 12 u
Milka,lookup,8,8,Alfajor MILKA mini mousse x6u,Alfajor Milka mousse leche 42 gr,Alfajor Milka triple mousse ne gro 55 gr
Pozo,lookup,8,8,Budin Pozo con frutas 170 gr,Budin Pozo vainilla 170 gr,Magdalena Pozo 220 gr
Puglisi,lookup,8,8,Atun Puglisi al natural 170 gr,Atun Puglisi en aceite 170 gr,Atun Puglisi en aceite sin sal 170 gr
Terrabusi,lookup,8,8,Fideos Terrabusi fusilli 500 grs,Fideos Terrabusi mostachol 500 grs,Fideos Terrabusi spaghetti N°3 500 grs
Acondicionado,heuristic,7,7,Aire acondicionado Hitachi inverter 5400w,Aire acondicionado Kelvinator 3300w,Aire acondicionado Kelvinator 5300w
Bc,heuristic,7,7,Mermelada BC arandanos 390 gr,Mermelada BC ciruela 390 gr,Mermelada BC damasco 390 gr
Body,heuristic,7,7,All body deo Dove lavender x 150ml,All body deo Dove men fig suede x 150ml,All body deo Dove men shea butter x 150ml
Bonu,heuristic,7,7,Film pvc Bonu repuesto 300mm300mt,Film pvc Bonu repuesto 380mm300mt,Jabon liquido Bonu botella 1.5 lt
Capilar,heuristic,7,7,Mascarilla capilar Sedal ceramidas x 300 g,Mascarilla capilar Sedal toque de seda x 300 g,Mascarilla capilar dove oleo nutricion 300gr
Centro,heuristic,7,7,Comoda Centro Estant 3 cajones,Comoda Centro Estant 3 cajones + guardado,Despensero Centro Estant simple
Descartable,heuristic,7,7,Maquina descartable Bic Confort Twin Sens,Maquina descartable Bic Sensitive,Maquina descartable Bic Soleil
La Abadia,heuristic,7,7,Arveja La Abadia partida 400 gr,Garbanzo La Abadia 400 gr,Lenteja La Abadia 400 gr
Liliana,heuristic,7,7,"""Ventilador Liliana turbo reclinable 16""""""",Batidora Liliana prettybat,Cafetera Liliana cofly 1.25 lt
Maped,heuristic,7,7,Crayoner Maped wax 12 u,Cutter Maped 9mm,Goma Maped mini technic 300 2 u
Mr.,heuristic,7,7,Canasta Mr. Musculo liquida marina repuesto,Canasta Mr. Musculo liquida pino repuesto,Limpiador Mr. Musculo anti grasa gatillo 500 cc
Navidad,heuristic,7,7,ARBOL DE NAVIDAD 1.2m,ARBOL DE NAVIDAD 1.8 m 2026,Adorno de Navidad diseños 4 piezas
Pepsi,heuristic,7,7,Gaseosa Pepsi black pet 1.5 lt,Gaseosa Pepsi black pet 2 lt,Gaseosa Pepsi lata 354 cc
Pla,heuristic,7,7,Enjuague bucal Pla Zero classic 250 ml,Enjuague bucal Pla Zero fresh mint 250 ml,Enjuague bucal Pla Zero soft mint 250 ml
Trio,heuristic,7,7,Frolitas Trio membrillo 300 gr,Galletitas Trio surtidas variette 500 gr,Galletitas Trio tartelettes frutos del bosque 300 gr
Benjamin,lookup,7,7,Vino Benjamin blend 750 cc,Vino Benjamin cabernet 750 cc,Vino Benjamin chardonnay 750 cc
Chandon,lookup,7,7,Champagne Chandon delice rose 750 cc,Espumante CHANDON aperitif 375 cc,Espumante CHANDON aperitif 750 cc
Chester,lookup,7,7,After shave Chester Ice 100 ml,Colonia Chester Ice 170 ml,Desodorante Chester Ice aerosol 150 cc
Cutex,lookup,7,7,Quitaesmalte Cutex experto x100ml,Quitaesmalte Cutex fortalecedor 100 ml,Quitaesmalte Cutex fortalecedor 50/60 ml
Dr.lemon,lookup,7,7,Aperitivo Dr.Lemon con limon lata 473 cc,Aperitivo Dr.Lemon con pomelo lata 473 cc,Aperitivo Dr.Lemon con vodka lata 473 cc
Duracell,lookup,7,7,Pila Duracell AA blister x2u,Pila Duracell AAA 4 u,Pila Duracell alcalina AA 2 u
Durax,lookup,7,7,Vaso Durax caroline 350cc,Vaso Durax cobra 350 cc,Vaso Durax coraline 250 cc 6 u
Godet,lookup,7,7,Flan Godet de dulce de leche 25/30 gr,Flan Godet de vainilla 25/30 gr,Gelatina Godet de frambuesa 25/30 gr
Green Hills,lookup,7,7,Te GREEN HILLS clasico x100u,Te GREEN HILLS clasico x25u,Te GREEN HILLS clasico x50u
Harpic,lookup,7,7,Canasta Harpic Power plus limpiador original 500 cc,Limpiador Harpic Power Plus citrus 500 cc,Limpiador Harpic Power plus frescura floral 500 cc
La Serenisima,lookup,7,7,Bebible La serenisima almendras sin azucar 1 lt,Bebida LA SERENISIMA almendra s/lac.1 lt,Dulce de leche LA SERENISIMA repostero calcio 400 gr
Mujercitas,lookup,7,7,Desodorante Mujercitas Funny 102 ml,Desodorante Mujercitas Sunny 102 ml,Desodorante Mujercitas aerosol 123 cc
Oreo,lookup,7,7,Galletita Oreo 118 gr,Galletitas OREO rell/choco. cacao 118 gr,"Galletitas Oreo 182,5 gr"
Paseo,lookup,7,7,Galletitas PASEO mini marineras 220 gr,Galletitas Paseo crackers 250/300 gr,Galletitas Paseo crackers 5 semillas 250/300 gr
Prestobarba,lookup,7,7,Maq PRESTOBARBA2 ultragrip x1u,Maquina PRESTOBARBA 3 hombre,Maquina Prestobarba 3 hombre 2 u
Suiza,lookup,7,7,Cera SUIZA liquida natural 5 lt,Cera Suiza incolora autobr. 400 cc,Cera Suiza liquida natural 425 cc
Sussex,lookup,7,7,Rollo de cocina SUSSEX ultra d/h 3ux60p,Rollo de cocina Sussex Clasico 50 paños 3 u,Rollo de cocina Sussex Clasico Pack ahorro 3 x 60p
Task,lookup,7,7,Cabo Task de madera,Escobillon Task exterior,Escobillon Task multiuso
Union,lookup,7,7,Mate cocido Union fi ltro diamantado sin ensobrar 25 u,Mate cocido Union fi ltro diamantado sin ensobrar 50 u,Mate cocido Union filtro diamantado sin ensobrar 100 u
Wassington,lookup,7,7,Autobrillo Wassington magico incoloro,Autobrillo Wassington magico marron,Autobrillo Wassington magico ne gro
Air,heuristic,6,6,Canasta Air Pur Max 2en1 elimina humedad lavanda repuesto,Canasta Air Pur Max 2en1 elimina humedad limon repuesto,Canasta Air Pur Mini 2en1 elimina humedad lavanda
Americano,heuristic,6,6,Aperitivo americano Gancia 1.25L,Aperitivo americano Gancia 450 cc,Aperitivo americano Gancia+lima/limon 473 cc
Bross,heuristic,6,6,Desodorante Bross London aerosol classic 150 cc,Desodorante Bross London aerosol warrior 150 cc,Perf. BROSS LONDON edt blue c/vap 100 ml
Chocolatada,heuristic,6,6,Leche chocolatada Cindor nueva tetra brik 200/250 cc,Leche chocolatada Cindor puro cacao tetra brick 1 lt,Leche chocolatada Las Tres Niñas 1 lt
