brand,brand_source,products_count,unique_names_count,sample_1,sample_2,sample_3
Chocolate,heuristic,6,6,Bolitas de chocolate Snuks sin tacc 200 gr,Chupetin de chocolate Paraguitas 13 gr,Corazon de chocolate Bon O Bon 120 g
Cocina,heuristic,6,6,Bateria cocina Loreto 4 piezas,Bateria cocina Multiflon negro 4 piezas,Bateria cocina Multiflon rojo 4 piezas
Cunnington,heuristic,6,5,Gaseosa Cunnington indian tonic 500 cc,Gaseosa Cunnington naranja pet 2.25 lt,Gaseosa Cunnington pomelo pet 2.25 lt
Depilatoria,heuristic,6,6,Banda depilatoria Depimiel para rostro 5 gr,Cera depilatoria Depimania natural 200 gr,Cera depilatoria Depimania natural repuesto 150 gr
Frutos,heuristic,6,6,Mix Frutos Secos Fincablanca amanecer 150 gr,Mix Frutos Secos Fincablanca americano 150 gr,Mix Frutos Secos Fincablanca cervecero 200 gr
Gre,heuristic,6,6,Vina gre Casa lta alcohol pet 1 lt,Vina gre Dos Anclas aceto balsamico bidon 3 lt,Vina gre Dos Anclas aceto pet 250 cc
Instantaneo LA,heuristic,6,6,Cafe instantaneo La Planta de Cafe en frasco 170 gr,Cafe instantaneo La Planta de Cafe frasco 170 gr,Cafe instantaneo La Planta de Cafe sin azucar doy pack 160 gr
Laddubar,heuristic,6,6,Barra Laddubar arandanos 30 gr,Barra Laddubar brownie 30 gr,Barra Laddubar choco naranja 30 gr
Limon,heuristic,6,6,Jugo de limon Dos Anclas 1 lt,Jugo de limon Dos Anclas 500 cc,Jugo de limon Favinco 1 lt
Lte,heuristic,6,6,Quitaesma lte Algabo fortalecedor 100 ml,Quitaesma lte Algabo fortalecedor 50 ml,Quitaesma lte Algabo humectante 100 ml
Papa,heuristic,6,6,Pure de papa Knorr instantaneo nueva formula 125 gr,Pure de papa Knorr instantaneo receta completa 125 gr,Pure de papa Maggi original instantaneo cremoso 125 gr
Paula,heuristic,6,6,Desod PAULA amor aero x 123 ml,Desodorante Paula aerosol 123 cc,Desodorante Paula alegria aerosol 123 ml
Pelikan,heuristic,6,6,Acuarelas Pelikan junior 13 piezas,Acuarelas Pelikan junior pastel 13 piezas,Borratintas Pelikan super pirat 2 u
S&p EN,heuristic,6,6,Anana S&P en rodajas 565 gr,Anana S&P en rodajas 850 gr,Anana S&P en trozos 565/567 gr
Seven UP,heuristic,6,6,Gaseosa Seven Up lata 354 cc,Gaseosa Seven Up pet 1.5 lt,Gaseosa Seven Up pet 2.25 lt/2.45 lt
Tic-tac,heuristic,6,6,Pastillas Tic-Tac frutilla estuche 16 gr,Pastillas Tic-Tac menta estuche 16 gr,Pastillas Tic-Tac menta estuche 49 g
Tramontina,heuristic,6,6,"""Cuchilla Tramontina carne premium 8""""""",Cuchara Tramontina dynamic 3 u,Cuchillo Tramontina dynamic 3 u
Aguila,lookup,6,6,Bizcochuelo Aguila chocolate 450 gr,Bizcochuelo Aguila torta humeda 450 gr,Chocolate Aguila ne gro 100 gr
Block,lookup,6,6,Individual blockprint azul 6 u,Individual blockprint gris 6 u,MANTEL BLOCK PRINT AZUL  2.00 X 3.00
Cachafaz,lookup,6,6,Galletitas Cachafaz con chips chocolate 225 gr,Galletitas Cachafaz inte gral  granola almendra 225 gr,Galletitas Cachafaz inte gral algarroba 225 gr
Cañuelas,lookup,6,6,Edulcorante Cañuelas clasico liquido 200 ml,Edulcorante Cañuelas stevia liquido 200 ml,Edulcorante Cañuelas sucralosa liquido 200 ml
Ceramicol,lookup,6,6,Cera Ceramicol autobrillo incoloro 900 cc,Cera Ceramicol autobrillo incoloro repuesto doy pack 450 ml,Cera Ceramicol autobrillo rojo 900 cc
Cofler,lookup,6,6,Chocolate Cofler  graffiti marroc 45 gr,Chocolate Cofler aireado leche 27 gr,Tableta Cofler aireado Bon o Bon 67 g
La Merced,lookup,6,6,Yerba La Merced barbacua ahumada 500  gr,Yerba La Merced campo monte armonica y distinguida 500  gr,Yerba La Merced campo suave 500  gr
Lucchetti,lookup,6,6,Fideos Lucchetti penne rigate N°45 500 grs,Fideos Lucchetti spaghetti N°7 500 grs,Fideos lucchetti letritas 500 gr
Magistral,lookup,6,6,Lavavajillas Magistral limon 215 ml,Lavavajillas Magistral limon cremoso x 300 ml,Lavavajillas Magistral limon cremoso x 500 ml
Maizena,lookup,6,6,Almidon Maizena maiz bolsa 220 gr,Almidon Maizena maiz bolsa 500 gr,Bizcochuelo Maizena chocolate sin tacc 450 gr
Mar,lookup,6,6,Marcador permanente Bic Marking azul,Marcadores Maped Color Peps duo 10 u,Marcadores Maped Color Peps ocean 6 u
Menthoplus,lookup,6,6,Pastillas Menthoplus 2 cereza 27.2 gr,Pastillas Menthoplus 2 naranja 27.2 gr,Pastillas Menthoplus cherry 29.4 gr
New Style,lookup,6,6,Ron New Style 40° 1 lt,Ron New Style 44 dorado 1 lt,Vodka New Style 1 lt
Nutrisse,lookup,6,6,Tintura Nutrisse kit 30 espresso,Tintura Nutrisse kit 40 cafe,Tintura Nutrisse kit 6660 manzana
Preferido,lookup,6,6,Pan rallado Preferido fortificado 1 kg,Pan rallado Preferido fortificado 500 gr,Rebozador Preferido 1 kg
Saladix,lookup,6,6,Galletitas Saladix calabresa 100 gr,Galletitas Saladix fuego picante 100 gr,Galletitas Saladix jamon 100 gr
Toddy,lookup,6,6,Cacao Toddy Etremo con vitaminas 360 gr,Cacao Toddy Etremo con vitaminas 800 gr,Cacao Toddy original 180 gr
Venus,lookup,6,6,Espuma de afeitar Venus protectora 150 ml,Maquina Venus suave 2 u,Maquina Venus suave 4 u
Verdeflor,lookup,6,6,Yerba Verdeflor boldo 500  gr,Yerba Verdeflor cedron 500  gr,Yerba Verdeflor con boldo 1  kg
Chimichurri,heuristic,5,5,Salsa chimichurri Dos Anclas 380 gr,Salsa chimichurri S&P pet 270 cc,Salsa chimichurri S&P tipo casero 275 gr
Darama,heuristic,5,5,Aji molido Darama bolsa 500 g,Comino Darama molido 500 gr,Oregano Darama bolsa 500 g
Desmaquillante,heuristic,5,5,Toalla desmaquillante Carmel suave 25 u,Toalla desmaquillante Neutrogena 25 u,Toalla desmaquillante Q-Soft humedas agua micelar 25 u
Doble,heuristic,5,5,Arroz doble Ala 1 kg,Arroz doble Dos Hermanos 1 kg,Arroz doble Gallo 500 gr
Entero,heuristic,5,5,Champignon entero S&P frasco 280 gr,Champignon entero S&P lata 400 gr,Tomate entero Arcor lata 400 gr
Escolar,heuristic,5,5,Cartuchera escolar,Repuesto escolar Exito cuadriculado N°3 288 hojas,Repuesto escolar Exito cuadriculado margen reforzado N°3 480 hojas
Glicerina,heuristic,5,5,Jabon glicerina Carmel 3 u 90 gr,Jabón glicerina LUX manzanilla x90g,Jabón liquido glicerina LUX Bromelia 220ml
Ledvance,heuristic,5,5,Lámpara Ledvance led gu10 par16 10w/830 eco,Lámpara Ledvance led gu10 par16 10w/865 eco,Lámpara Ledvance led gu10 par16 7w/865 eco
Mani,heuristic,5,5,Mantequilla de mani Croppers 305 grs,Pasta de mani Croppers 305 grs,Turron de mani Arcor 10 u 25 gr
Micelar,heuristic,5,5,Agua micelar Neutrogena 200 ml,Agua micelar Neutrogena hydro boost 200 ml,Agua micelar Nivea rose care 200 ml
Mondial,heuristic,5,5,Parlante mondial portatil 400 w,Parlante mondial portatil 700 w,Plancha mondial seca 1200 w
Mor,heuristic,5,5,Conservadora Mor azul x 34lt,Conservadora Mor rojo x 34lt,Escalera Mor 3 escalones aluminio
Parbolizado,heuristic,5,5,Arroz parbolizado  Dos Hermanos  1 kg,Arroz parbolizado  Gallo oro bolsa 1 kg,Arroz parbolizado Dos hermanos 500 gr
Picante,heuristic,5,5,Mayonesa picante Hellmanns doypack 250 gr,Snack picante Doritos flamin hot 82 g,Snack picante Takis fuego 85 g
Pie,heuristic,5,5,"""Ventilador de pie Liliana metal 18""""""","""Ventilador de pie Liliana plastico 18""""""",Pala de pie Glow vega
Piso,heuristic,5,5,Limpiador piso Bio Active oxygel 750 ml,Secador de piso GLOW doble goma,Secador de piso Samantha 40 cm
Pizza,heuristic,5,5,Salsa pizza Arcor doypack 340 gr,Salsa pizza Cica 340 gr,Salsa pizza Knorr 200 gr
Polvo BC,heuristic,5,5,Jugo en polvo BC limonada 7/9.3 gr,Jugo en polvo BC mango/naranja 7/7.9 gr,Jugo en polvo BC manzana 7/8.5 gr
Postre,heuristic,5,5,Cuchara de postre acero inoidable 6 u,PLATO POSTRE zambia rojo 20 cm,Plato Postre zambia azul 20 cm
Sprite,heuristic,5,5,Gaseosa Sprite lata 354 cc,Gaseosa Sprite pet 1.5 lt,Gaseosa Sprite pet 2.25 lt
Teatrical,heuristic,5,5,Crema facial Teatrical aclaradora 200 gr,Crema facial Teatrical antiarrugas 100 gr,Crema facial Teatrical antiarrugas 200 gr
Vidrios,heuristic,5,5,Limpia vidrios Cif doy pack 450 ml,Limpia vidrios Cif doy pack 900 ml,Limpia vidrios Cif mu ltiuso 5 lt
Vino,heuristic,5,5,COPA vino ballon skinpack 190 ml 6 u,COPA vino ballon skinpack 250 ml 6 u,Cocktail de vino Emilia spritz 750 ml
Acqua Di Colbert,lookup,5,5,Desodorante Acqua Di Colbert 150 cc,Desodorante Acqua Di Colbert 250 cc,Estuche Acqua di colbert desodorante + perfume
Aleluya,lookup,5,5,Miel ALELUYA liquida sin ta cc 190 gr,Miel Aleluya liquida con limon sin tacc 250 gr,Miel Aleluya liquida con naranja sin tacc 250 gr
Alma Mora,lookup,5,5,Vino Alma Mora cabernet 750 cc,Vino Alma Mora malbec 750 cc,Vino Alma Mora reserva malbec 750 cc
Amanda,lookup,5,5,Yerba Amanda 500  gr,Yerba Amanda sele ccion 1  kg,Yerba Amanda sele ccion 500  gr
Bimbo,lookup,5,5,Budin Bimbo vainilla 170 gr,Grisines Bimbo cebolla asada x75g,Grisines Bimbo ciboulette/manteca  x75g
Callia,lookup,5,5,Vino Callia cabernet sauvignon 750 cc,Vino Callia cabernet/syrah 750 cc,Vino Callia malbec 750 cc
Castell,lookup,5,5,Aceitunas CASTELL verdes descarozadas pet 800 gr,Aceitunas Castell ne gras descarozadas frasco 650 gr,Aceitunas Castell verdes 0 frasco 900 gr
Chocolinas,lookup,5,5,Galletitas Chocolinas 100 gr,Galletitas Chocolinas 170 gr,Galletitas Chocolinas 250 gr
Cica,lookup,5,5,Fideos Cica coditos 500 g,Fideos Cica mostachol fortificado 500 gr,Fideos Cica spaguetti forti 500 g
Doncella,lookup,5,5,Algodon DONCELLA hidrofilo super 200 gr#,Algodon Doncella 140 gr,Algodon Doncella 300 gr
Doritos,lookup,5,5,Nachos DORITOS de queso 77 gr,Nachos Doritos de queso 129 gr,Nachos Doritos de queso 200 gr
Familia Gascon,lookup,5,5,Vino Familia Gascon cabernet 750 cc,Vino Familia Gascon malbec 750 cc,Vino Familia Gascon red blend 750 cc
Fuyi,lookup,5,5,Aparato FUYI liquido electrico+repuesto,Insecticida Fuyi 45 noches repuesto,Insecticida Fuyi mata moscas y mosquitos 360 cc
Gallo,lookup,5,5,Arroz Gallo oro seleccion 1 kg,Risotto Gallo 4 quesos 240 gr,Risotto Gallo a la española 240 gr
Kotex,lookup,5,5,Tampones Kotex digitales medio 20 u,Tampones Kotex digitales super 20 u,Tampones Kotex medio x12u
La Tranquera,lookup,5,5,Yerba LA TRANQUERA liviana x500gr,Yerba LA TRANQUERA seleccion x1kg,Yerba LA TRANQUERA seleccion x500gr
Latitud 33,lookup,5,5,Espumante Latitud 33 etra brut 750 cc,Espumante Latitud 33 rosado 750 cc,Vino Latitud 33 cabernet 750 cc
Lay's,lookup,5,5,Papas fritas LAY'S clasicas 85 gr,Papas fritas Lay's clasicas 134 gr,Papas fritas Lay's clasicas 230 gr
Misky,lookup,5,5,Caramelos Misky masticables 800 gr,Caramelos Misky rellenos miel 675 gr,Chocolate Misky con leche 50 gr
Mortimer,lookup,5,5,Esonja Mortimer de bronce doble cara,Esponja Mortimer cuadrada abrasiva,Esponja Mortimer de fibra cuadriculada
Nesquik,lookup,5,5,Cacao NESQUIK menos azucar 300 gr,Cacao Nesquik fortificado en hierro 2 kg,Cereal Nesquik duo 210 g
Nestle,lookup,5,5,Bombones Nestle especialidades 251 gr,Chocolate Nestle con mani 33 gr,Chocolate Nestle crunch 80 gr
Nestum,lookup,5,5,Cereal NESTUM mu lticereal s/azucar500 gr,Cereal Nestum banana sin azucar 225 gr,Cereal Nestum cereal sin azucar 225 gr
Nieto Senetiner,lookup,5,5,Espumante Nieto Senetiner brut nature 750 cc,Espumante Nieto Senetiner brut rose 750 cc,Espumante Nieto Senetiner etra brut 750 cc
O.b.,lookup,5,5,Tampones O.B. medio 16 u,Tampones O.B. original medio 8 u,Tampones O.B. original mini 8 u
Paco,lookup,5,5,Colonia Paco  60 ml,Colonia Paco 90 ml,Colonia Paco futbol 60 ml
Palmolive,lookup,5,5,Jabon Palmolive jazmin y cacao 85 gr,Jabon Palmolive karite hidratación intensa 85 gr,Jabon Palmolive nutrimilk 85 g
Playadito,lookup,5,5,Mate cocido PLAYADITO  50sq,Mate cocido PLAYADITO 25sq#,Yerba Playadito 1  kg
Polvorita,lookup,5,5,Galletitas Polvorita chocolate relleno vainilla 80 / 81 gr,Galletitas Polvorita relleno vainilla 150 / 152 gr,Galletitas Polvorita vainilla relleno frutilla 150 / 152 gr
Rosamonte,lookup,5,5,Te Rosamonte clasico 25 sq,Yerba Rosamonte 55 aniversario 1  kg,Yerba Rosamonte Plus 55 aniversario 500  gr
Villeneuve,lookup,5,5,Crema Villeneuve piel equilibrada 250 ml,Crema Villeneuve piel equilibrada 400 ml,Crema Villeneuve piel etra seca 250 ml
3,heuristic,4,4,Licor 3 Plumas cafe al cognacs 750 cc,Licor 3 Plumas chocolate 700 cc,Licor 3 Plumas melon x700cc
Abel,heuristic,4,4,Vino Abel Michel Torino abocado 700 cc,Vino Abel Michel Torino sucesion blanco 700 cc,Vino Abel Michel Torino sucesion tinto 1.125 lt
Adhesivo,heuristic,4,4,Bloque adhesivo PATO encanto floral 3u x 8.2 gr,Bloque adhesivo Pato brisa tropical 3u x 8.2 gr,Disco adhesivo PATO Lavanda x 38 g
Aluminio,heuristic,4,4,Papel aluminio Glow 1 u x 25 mts,Papel aluminio Glow 1 u x 4 mts,Papel aluminio foil Bonu 28 cm 7.5mt
Amarillo,heuristic,4,4,Choclo amarillo Bonmar  grano 280/300 gr,Choclo amarillo S&P  grano abre facil 280/300 gr,Choclo amarillo S&P cremoso 300/350 gr
Andes,heuristic,4,4,Cerveza Andes Origen ipa lata 473 cc,Cerveza Andes Origen ne gra lata 473 cc,Cerveza Andes Origen roja lata 473 cc
Blenders,heuristic,4,4,Licor Blenders Honey con miel 750 cc,Whisky Blenders 1 lt,Whisky Blenders 200 cc
Caesar,heuristic,4,4,Salsa caesar Dos Anclas 350 gr,Salsa caesar Dos Anclas light 360 gr,Salsa caesar S&P 265 gr
Chucker,heuristic,4,4,Edulcorante Chucker liquido 200 cc,Edulcorante Chucker liquido 400 cc,Edulcorante Chucker stevia liquido 200 cc
Close UP,heuristic,4,4,Crema dental Close up menta 70 gr,Crema dental Close up menta americana 70 gr,Crema dental Close up menta fresca 70 gr
Eco DE,heuristic,4,4,Agua mineral Eco de los Andes 1.5 lt,Agua mineral Eco de los Andes 2 lt,Agua mineral Eco de los Andes 500 cc
Entrefina,heuristic,4,4,Sal entrefina Celusal estuche 1 kg,Sal entrefina Celusal paquete 1 kg,Sal entrefina Dos Anclas bolsa 25 kg
Etilico,heuristic,4,4,Alcohol etilico BIALCOHOL 96 % pet 1 lt,Alcohol etilico bialcohol 96 % pet 250 ml,Alcohol etilico bialcohol 96% pet 500 ml
Frito,heuristic,4,4,Mani frito Croppers con sal 105 grs,Mani frito Croppers con sal 350 grs,Mani frito Croppers con sal 800 grs
Gas,heuristic,4,4,Agua con gas Cellier 2 lt,Agua con gas Cellier 600 cc,Agua con gas Glaciar botella 1.5 lt
Gel,heuristic,4,4,Alcohol en gel Carmel 250 cc,Alcohol en gel bialcohol pet 250 ml,Boligrafo de gel Bic recargable 1 u
H&s,heuristic,4,4,Shampoo H&S dermo sens.aloe 180 ml,Shampoo H&S fuerte d.la raiz 375 ml,Shampoo H&S nutrición honey x 180 ml
Hall's,heuristic,4,4,Pastillas Hall's cherry 25 2 gr,Pastillas Hall's menta lyptus 28 gr,Pastillas Hall's mentho lyptus 25 2 gr
Integral,heuristic,4,4,Arroz integral Dos Hermanos 1 kg,Arroz integral Gallo Oro bolsa 500 gr,Arroz integral Molinos Ala bolsa 1 kg
Membrillo,heuristic,4,4,Dulce de membrillo Emeth cajon 5 kg,Dulce de membrillo Emeth pouch 500 gr,Dulce de membrillo Noel cajon 5 kg
Merclin,heuristic,4,4,Destapacañerias Merclin concentrado x 500 ml,Destapacañerias Merclin max gel x 500 ml,Limpiador Merclin gel 500 ml
Mug,heuristic,4,4,JARRO mug cassia botones 318.9 cc,JARRO mug cassia helecho 318.9 cc,JARRO mug chromat surtido 275 cc
Neutrogena,heuristic,4,4,Crema corporal Neutrogena hidrata y repara 200 ml,Crema corporal Neutrogena hidrata y suaviza 200 ml,Crema facial Neutrogena mate 3 en 1 100 gr
Rallado LA,heuristic,4,4,Queso rallado LA SERENISIMA sobre 35 gr,Queso rallado La Paulina 150 gr,Queso rallado La Paulina 40 gr
Rasta,heuristic,4,4,Alfajor Rasta blanco 70 g,Alfajor Rasta negro 70 g,Alfajor Rasta trico 100 g
Reposteria,heuristic,4,4,Baño reposteria Aguila blanco 150 gr,Baño reposteria Aguila leche 150 gr,Baño reposteria Aguila semiamargo 150 gr
Smams,heuristic,4,4,Galletitas SMAMS choco rellenas x105g,Galletitas Smams chocolate 250 gr,Galletitas Smams cracker clasica 150 gr
Speed,heuristic,4,4,Energizante Speed  473/500 cc,Energizante Speed 250 cc,Energizante Speed zero 269 cc
Te,heuristic,4,4,Cuchara te Tramontina dynamic 3 u,Cucharas Te acero inoidable tifanny 3 unidades,Cucharas de te acero inoidable 6 u
Teka,heuristic,4,4,Toalla Teka duomo colores surtidos 4580 cm 2 piezas,Toalla Teka duomo verde beige naranja 90150 2 piezas,Toalla Teka hanna 90150 cm 2 piezas
Vais,heuristic,4,4,Repelente Vais crema 100 gr,Repelente Vais extreme 200 ml,Repelente Vais spray 200 ml
Ariel,lookup,4,4,Jabon liquido Ariel delicados doypack 3 lt,Jabon liquido Ariel platinum botella 800 ml,Jabon liquido Ariel platinum botella para diluir 500 ml
Cheetos,lookup,4,4,Maicitos Cheetos clasico queso 43 gr,Maicitos Cheetos ondulados queso crema 85 gr,Maicitos Cheetos sabor queso 140 gr
Circus,lookup,4,4,Vino Circus cabernet 750 cc,Vino Circus malbec 750 cc,Vino Circus roble cabernet sauvignon 750 cc
Colon,lookup,4,4,Colonia Danielle Jolie eau de toilette 90 ml,Colonia Danielle eu de toillette 90 ml,Colonia Johnson Baby fresca caricia 200 ml
Criollitas,lookup,4,4,Galletitas Criollitas 100 gr,Galletitas Criollitas 3 u 100 gr,Galletitas Criollitas 5 u 99 gr
Dada,lookup,4,4,Vino Dada cabernet 750 cc,Vino Dada malbec 750 cc,Vino Dada n1 vainilla 750 cc
Downy,lookup,4,4,Suavizante Downy adoravel 900 ml,Suavizante Downy brisa intenso 500 ml,Suavizante Downy brisa verano/fresca 1 lt
Finca las Moras,lookup,4,4,Vino Finca las Moras cabernet 750c,Vino Finca las Moras malbec 750 cc,Vino Finca las Moras sauvignon blanc 750 cc
Fructis,lookup,4,4,Acondicionador Fructis probiotics 200 ml,Crema para peinar Fructis 10 en 1  250 ml,Shampoo Fructis oil repair recarga nutricion 350 ml
Giacomo,lookup,4,4,Capelettini Giacomo de carne 500 gr,Capelettini Giacomo de jamon y queso 500 gr,Capelettini Giacomo de verdura 500 gr
Gillete,lookup,4,4,Foamy Gillete menthol 175 gr,Foamy Gillete menthol 312 gr,Foamy Gillete piel sensitive 312 gr
Gillette,lookup,4,4,Espuma de afeitar Gillette con aloe vera 150 ml,Maquina Gillette cuerpo 2 u,Maquina Gillette cuerpo 4 u
Glaciar,lookup,4,4,Agua Glaciar bidón 6.3 lt,Agua Glaciar botella 1.5 lt,Agua Glaciar botella 2 lt
Guaymallen,lookup,4,4,Alfajor Guaymallen blanco 38 gr,Alfajor Guaymallen ne gro 38 gr,Alfajor Guaymallen triple blanco 75 gr
Hogareñas,lookup,4,4,Galletitas Hogareñas 7 semillas 189 gr,Galletitas Hogareñas mix cereales 3ux185gr,Galletitas Hogareñas salvado 200 gr
Kolynos,lookup,4,4,Crema dental Kolynos blanco con calcio 180 gr,Crema dental Kolynos blanco con calcio 90 gr,Crema dental Kolynos etra fresh 70 gr
Lipo,lookup,4,4,Caramelos Lipo bolon menta 120 g,Caramelos Lipo gajitos 120 g,Caramelos Lipo gajitos 454 g
Lopez,lookup,4,4,Espumante Lopez dulce 750 ml,Espumante Lopez etra brut 750 ml,Vino Lopez dulce natural 750 cc
Mapa,lookup,4,4,Guantes Mapa plisse satinado L 8-2/9,Guantes Mapa plisse satinado M 7-1/2-8,Guantes Mapa plisse satinado S 6-1/2-7
Nucrem,lookup,4,4,Postre Nucrem chocolatado 170 gr,Postre Nucrem original 150 gr,Postre Nucrem original 290 gr
Odol,lookup,4,4,Crema dental Odol doble a ccion 180 gr,Crema dental Odol doble a ccion 70 gr,Crema dental Odol doble accion 90 gr
Patrichs,lookup,4,4,Desodorante Patrichs  grand pri 150 ml,Desodorante Patrichs  grand prix 230 ml,Desodorante Patrichs acqua 230 ml
Philco,lookup,4,4,Bicicleta Philco sicilia negra R28,Pilas Philco AA 16 u,Pilas Philco AA 4 u
Q-soft,lookup,4,4,Hisopos Q-SOFT estuche 75 u,Hisopos Q-SOFT pote 100 u,Hisopos Q-SOFT pote 150 u
Rex,lookup,4,4,Galletitas Rex bolsa 75 gr,Limpiador Rex metales 200 ml,Limpiador Rex multisuperficie floral 5 lt
Silisur,lookup,4,4,Cera Silisur crema 600 cc,Shampoo Silisur silicona manzana 600 cc,Silicona Silisur new car aerosol 260 gr
Swift,lookup,4,4,Grasa Swift vacuna 500 gr,Pate Swift  jamon del diablo 90 gr,Pate Swift lata 90 gr
Tio Nacho,lookup,4,4,Acondicionador Tio Nacho anticanas 415 ml,Shampoo Tio Nacho aclarante 415 ml,Shampoo Tio Nacho anticanas 415 ml
Twistos,lookup,4,4,Tostaditas TWISTOS jamon 155 gr,Tostaditas Twistos jamon 95 gr,Tostaditas Twistos queso 155 gr
Uvita,lookup,4,4,Vino Uvita blanco dulce tetrabrik 1 lt,Vino Uvita blanco tetrabrik 1 lt,Vino Uvita tinto dulce tetrabrik 1 lt
Villa del Sur,lookup,4,4,Agua mineral Villa del Sur 1.65 lt,Agua mineral Villa del Sur 2.25/2.5 lt,Agua mineral Villa del Sur 600 cc
Villavicencio,lookup,4,4,Agua mineral Villavicencio 1.5 lt,Agua mineral Villavicencio 2 lt,Agua mineral Villavicencio 500 cc
Vitina,lookup,4,4,Semola Vitina clasica 250 gr,Semola Vitina clasica 500 gr,Semola Vitina de espinaca 250 gr
2,heuristic,3,3,Escurreplatos 2 estantes,Escurreplatos 2 estantes deluxe,Set 2 lanzadores con 6 dardos
Afeitar,heuristic,3,3,Gel afeitar Nivea sensitive 200 ml,Maquina de afeitar descartable Presobarba3 carbon x 2 u,Maquina de afeitar descartable Prestobarba 3 carbon x 4 u
Argentino,heuristic,3,3,Jabon en pan Argentino blanco 2 u 200 gr,Jabon en pan Argentino blanco 200 gr,Jabon en pan Argentino blancura extrema 150 gr
Azabache,heuristic,3,3,Espumante Azabache extra brut 750 cc,Espumante Azabache extra dulce 750 ml,Vino Azabache malbec roble 750 cc
Barbacoa,heuristic,3,3,Salsa barbacoa DANICA ahumada x220gr,Salsa barbacoa Hellmanns bolsa 3 kg,Salsa barbacoa Hellmanns doy pack 250 gr
Base DE,heuristic,3,3,Bebida a base de hierbas 1 lt,Bebida a base de hierbas 450 cc,Bebida a base de hierbas 750 cc
Bañadas,heuristic,3,3,Galletitas bañadas Cofler Bon o bon 105.6 gr,Galletitas bañadas Cofler choco cookie 132.8 gr,Galletitas bañadas Cofler chocolate 105.6 gr
Bgh,heuristic,3,3,Microondas BGH doble grill 25 lt,Microondas BGH mecanico 20L,Microondas Bgh Quick Chef digital 20lt
Bianchi,heuristic,3,3,Vino BIANCHI VARIETALES malbec  750 ml,Vino Bianchi Marlo dulce 750 cc,Vino Bianchi famiglia malbec 750 cc
Bon,heuristic,3,3,Bizcochuelo Bon Mase 3 capas chocolate x450gr,Bizcochuelo Bon Mase 3 capas vainilla x450gr,Pionono Bon Mase pionono x180gr
Cheddar,heuristic,3,3,Salsa cheddar Danica  950 g,Salsa cheddar Dos Anclas 360 gr,Salsa cheddar TAU 300 gr
Concentrad,heuristic,3,3,Suvizante concentrad Downy adoravel x 450 ml,Suvizante concentrad Downy mistico x 500 ml,Suvizante concentrad Downy suav x 500 ml
Concentrado,heuristic,3,3,Jugo concentrado Mocoreta pomelo 1.5 lt,Suavizante concentrado Comfort brisa elegante botella x 1 lt,Suvizante concentrado Downy brisa botella x 1 lt
Contigo,heuristic,3,3,Botella termica Contigo acero matterhorn 591 ml,Botella termica Contigo granito matterhorn 591 ml,Botella termica Contigo negra matterhorn 591 ml
Cósmico,heuristic,3,3,Mate cocido Cósmico 25 sq,Mate cocido Cósmico 50 sq,Yerba Cósmico 500 g
D.r.f.,heuristic,3,3,Pastillas D.R.F. limon 23 gr#,Pastillas D.R.F. menta 23 gr,Pastillas D.R.F. surtida 23g
Dent,heuristic,3,3,Cepillo dent Colgate super flexi suave x 2 u,Crema dent CLOSE UP mas blancos x90g,Crema dent COLGATE Sens encias x100g
Denta,heuristic,3,3,Cepillo denta Colgate 360 white mediano 2 u,Cepillo denta Colgate maxwhite Carbon 2 u,Cepillo denta Colgate slim soft suave x 2 u
Drean,heuristic,3,3,Heladera Drean inverter 516 lt,LAVARROPA drean inverter c/frontal 8kg,Secarropas Drean centrifugo 6.5kg
Espuma,heuristic,3,3,Jabón en espuma Plusbelle esencia piel sensible doy pack 230 ml,Jabón en espuma Plusbelle esencia piel sensible valvula 250 ml,Jabón en espuma Plusbelle esencia valvula 250 ml
Faber-castell,heuristic,3,3,Ecolapices Faber-Castell caras colores 24+3 u,Ecolapices Faber-Castell largos colores 12 u + 3  grafitos,Ecolapiz Faber-Castell  grafito 1205 4 u
Frutigran,heuristic,3,3,Galletitas Frutigran avena y pasas 250 gr,Galletitas Frutigran chips chocolate 255 gr,Galletitas Frutigran salvado dulce 250 g
Frutty,heuristic,3,3,Barra Frutty banana y dulce de leche 24 g,Barra Frutty frutilla y yogurt 24 g,Barra Frutty manzana 24 g
Glow,heuristic,3,3,Escoba Glow max unux,Escobillon Glow interior capella,Separadores Glow 25 x 25 cm 10 u
Go!,heuristic,3,3,Esponja GO! acero inoidable 30 gr,Esponja GO! maz mu ltiuso,Esponja GO! protege uñas
Gordon's,heuristic,3,3,Gin Gordon's london dry 700 cc,Gin Gordon's london pink 700 cc,Gin Gordon's london tonic 473 cc
Ha,heuristic,3,3,Chocolate Ha mlet chocolatoso 43 gr,Chocolate Ha mlet con almendras y mani 45 gr,Chocolate Ha mlet yogurt frutilla 43 gr
Heineken,heuristic,3,3,Cerveza Heineken lata 473 cc,Cerveza Heineken lata 710 cc,Cerveza Heineken porron No Retornable 330 cc
Incontinencia,heuristic,3,3,Toalla de incontinencia Lina con alas 8 u,Toalla de incontinencia PLENITUD femme 20 u,Toalla de incontinencia Plenitud femme esencial x 8 u
Infantil LA,heuristic,3,3,Leche infantil La Serenisima Baby 1 tetrabrik 200 cc,Leche infantil La Serenisima Baby 2 tetrabrik x200cc,Leche infantil La Serenisima Baby 3 tetra brick 200 ml
Ivess,heuristic,3,3,Soda Ivess botella 2.25 lt,Soda Ivess menos sodio sifon 1.5/1.75 lt,agua ivess x500cc agua ivess x500cc
Japones,heuristic,3,3,Mani japones Croppers chilli pepper y lima 85 g,Mani japones Croppers jalapeño 85 g,Mani japones Maniax sabor jamon 95 gr
Johnnie,heuristic,3,3,Whisky Johnnie Walker etiqueta dorada 750 cc,Whisky Johnnie Walker etiqueta ne gra 750 cc,Whisky Johnnie Walker etiqueta roja 750 cc
Las Perdices,heuristic,3,3,Vino Las Perdices cabernet sauvignon 750 cc,Vino Las Perdices malbec 750 cc,Vino Las Perdices sauvignon blanco 750 cc
Lays,heuristic,3,3,Papa fritas Lays ketchup 77 grs,Papa fritas Lays ondas flamin hot 70 gr,Papa fritas Lays queso y cebolla 77 grs
Liq,heuristic,3,3,Canasta liq PATO lavanda ap+rep x50ml,Jabon liq WOOLITE t dias d/p x1.5lt,Jabón liq Lux glicerina manzanilla x 300 ml
Lista,heuristic,3,3,Pasta lista Box salsa bolognesa vaso 64 grs,Pasta lista Box salsa fileto vaso 64 grs,Pasta lista MENU BOX s/rosa vaso x64g
Ltador,heuristic,3,3,Resa ltador Bic Marking amarillo 1 u,Resa ltador Bic Marking surtido 4 u,Resa ltador Bic Marking verde 1 u
Lu,heuristic,3,3,Fideo Lu cchetti dedalitos 500 gr,Jabon liquido Lu magico orquidea ne gra repuesta 220 ml,Jabon liquido Lu suavidad de rosa francesa repuesto .220 ml
Luigi,heuristic,3,3,Vino Luigi Bosca chardonay 750 cc,Vino Luigi Bosca malbec 750 cc,Vino Luigi Bosca sangre malbec 750 cc
Lumila,heuristic,3,3,Termo Lumila gro acero inoidable 1 lt,Termo Lumila gro supertermico 1 lt,Termo Lumila gro terra 1 lt
Maisto,heuristic,3,3,AUTO maisto racing spec 1/24 cole ccionables,AUTO maisto raicing whipflash,AUTOS maisto 5 unidades
Maiz,heuristic,3,3,Copos de maiz Lasfor azucarados 240 gr,Copos de maiz S&P azucarados 240 gr,Copos de maiz S&P fortificados 150 gr
Merle,heuristic,3,3,Gin Merle london 750 ml,gin MERLE orange 750 ml,gin MERLE pink 750 ml
